id,title,question_text,choices
9174858,Question 1,"<link rel=""stylesheet"" href=""https://instructure-uploads.s3.amazonaws.com/account_73010000000000001/attachments/24286017/dp_app.css"">Which of the following is a key principle of Software Engineering?<script src=""https://instructure-uploads.s3.amazonaws.com/account_73010000000000001/attachments/24286016/dp_app.js""></script>",Agility; Randomness; Chaos; Simplicity
9174859,Question 2,"<link rel=""stylesheet"" href=""https://instructure-uploads.s3.amazonaws.com/account_73010000000000001/attachments/24286017/dp_app.css"">What does the Software Development Life Cycle (SDLC) encompass?<script src=""https://instructure-uploads.s3.amazonaws.com/account_73010000000000001/attachments/24286016/dp_app.js""></script>","Only coding; Planning, design, implementation, testing, and maintenance; Only testing; Only requirements gathering"
9174860,Question 3,"<link rel=""stylesheet"" href=""https://instructure-uploads.s3.amazonaws.com/account_73010000000000001/attachments/24286017/dp_app.css"">What is the purpose of requirements elicitation in Software Engineering?<script src=""https://instructure-uploads.s3.amazonaws.com/account_73010000000000001/attachments/24286016/dp_app.js""></script>",To gather and define stakeholder needs; To write code; To test software; To deploy applications
9174861,Question 4,"<link rel=""stylesheet"" href=""https://instructure-uploads.s3.amazonaws.com/account_73010000000000001/attachments/24286017/dp_app.css"">Which methodology emphasizes iterative development and flexibility?<script src=""https://instructure-uploads.s3.amazonaws.com/account_73010000000000001/attachments/24286016/dp_app.js""></script>",Waterfall; Agile; Spiral; V-Model
9174862,Question 5,"<link rel=""stylesheet"" href=""https://instructure-uploads.s3.amazonaws.com/account_73010000000000001/attachments/24286017/dp_app.css"">What is defensive programming?<script src=""https://instructure-uploads.s3.amazonaws.com/account_73010000000000001/attachments/24286016/dp_app.js""></script>",A method to anticipate potential errors; A way to write code without testing; A technique to ignore user feedback; A method to speed up coding
9174863,Question 6,"<link rel=""stylesheet"" href=""https://instructure-uploads.s3.amazonaws.com/account_73010000000000001/attachments/24286017/dp_app.css"">What is the significance of software testing?<script src=""https://instructure-uploads.s3.amazonaws.com/account_73010000000000001/attachments/24286016/dp_app.js""></script>",To ensure software meets requirements and is defect-free; To increase software size; To reduce software costs; To eliminate documentation
9174864,Question 7,"<link rel=""stylesheet"" href=""https://instructure-uploads.s3.amazonaws.com/account_73010000000000001/attachments/24286017/dp_app.css"">What does Agile Development promote?<script src=""https://instructure-uploads.s3.amazonaws.com/account_73010000000000001/attachments/24286016/dp_app.js""></script>",Flexibility and collaboration; Strict adherence to plans; Isolation of team members; Minimizing user feedback
9174865,Question 8,"<link rel=""stylesheet"" href=""https://instructure-uploads.s3.amazonaws.com/account_73010000000000001/attachments/24286017/dp_app.css"">What is the role of quality assurance in Software Engineering?<script src=""https://instructure-uploads.s3.amazonaws.com/account_73010000000000001/attachments/24286016/dp_app.js""></script>",To ensure software meets specified requirements; To ignore user needs; To focus solely on coding; To reduce project timelines
9174866,Question 9,"<link rel=""stylesheet"" href=""https://instructure-uploads.s3.amazonaws.com/account_73010000000000001/attachments/24286017/dp_app.css"">What is encapsulation in Object-Oriented Programming?<script src=""https://instructure-uploads.s3.amazonaws.com/account_73010000000000001/attachments/24286016/dp_app.js""></script>",Hiding data and methods within a class; Sharing data across classes; Creating global variables; Using only public methods
9174867,Question 10,"<link rel=""stylesheet"" href=""https://instructure-uploads.s3.amazonaws.com/account_73010000000000001/attachments/24286017/dp_app.css"">What is the purpose of version control systems?<script src=""https://instructure-uploads.s3.amazonaws.com/account_73010000000000001/attachments/24286016/dp_app.js""></script>",To track changes in code; To write code faster; To eliminate bugs; To manage hardware
9174868,Question 11,"<link rel=""stylesheet"" href=""https://instructure-uploads.s3.amazonaws.com/account_73010000000000001/attachments/24286017/dp_app.css"">What does the design stage in the SDLC involve?<script src=""https://instructure-uploads.s3.amazonaws.com/account_73010000000000001/attachments/24286016/dp_app.js""></script>",Translating requirements into a blueprint; Writing code; Testing software; Deploying applications
9174869,Question 12,"<link rel=""stylesheet"" href=""https://instructure-uploads.s3.amazonaws.com/account_73010000000000001/attachments/24286017/dp_app.css"">What is the importance of documentation in Software Engineering?<script src=""https://instructure-uploads.s3.amazonaws.com/account_73010000000000001/attachments/24286016/dp_app.js""></script>",To provide essential information about software; To confuse users; To reduce coding time; To eliminate testing
9174870,Question 13,"<link rel=""stylesheet"" href=""https://instructure-uploads.s3.amazonaws.com/account_73010000000000001/attachments/24286017/dp_app.css"">What is the role of UML diagrams?<script src=""https://instructure-uploads.s3.amazonaws.com/account_73010000000000001/attachments/24286016/dp_app.js""></script>",To visually represent software design; To write code; To test software; To manage databases
9174871,Question 14,"<link rel=""stylesheet"" href=""https://instructure-uploads.s3.amazonaws.com/account_73010000000000001/attachments/24286017/dp_app.css"">What is the significance of non-functional requirements?<script src=""https://instructure-uploads.s3.amazonaws.com/account_73010000000000001/attachments/24286016/dp_app.js""></script>",They impact performance and usability; They are not important; They only relate to coding; They are only for testing
9174872,Question 15,"<link rel=""stylesheet"" href=""https://instructure-uploads.s3.amazonaws.com/account_73010000000000001/attachments/24286017/dp_app.css"">What does modularity in software design promote?<script src=""https://instructure-uploads.s3.amazonaws.com/account_73010000000000001/attachments/24286016/dp_app.js""></script>",Breaking down software into manageable components; Creating monolithic applications; Ignoring user feedback; Reducing testing
9174873,Question 16,"<link rel=""stylesheet"" href=""https://instructure-uploads.s3.amazonaws.com/account_73010000000000001/attachments/24286017/dp_app.css"">What is the purpose of unit testing?<script src=""https://instructure-uploads.s3.amazonaws.com/account_73010000000000001/attachments/24286016/dp_app.js""></script>",To evaluate individual components of code; To test the entire application; To ignore bugs; To speed up development
9174874,Question 17,"<link rel=""stylesheet"" href=""https://instructure-uploads.s3.amazonaws.com/account_73010000000000001/attachments/24286017/dp_app.css"">What is the Agile Manifesto?<script src=""https://instructure-uploads.s3.amazonaws.com/account_73010000000000001/attachments/24286016/dp_app.js""></script>",A set of principles for Agile development; A coding standard; A testing framework; A project management tool
9174875,Question 18,"<link rel=""stylesheet"" href=""https://instructure-uploads.s3.amazonaws.com/account_73010000000000001/attachments/24286017/dp_app.css"">What is the focus of Software Requirements Engineering?<script src=""https://instructure-uploads.s3.amazonaws.com/account_73010000000000001/attachments/24286016/dp_app.js""></script>",Defining and documenting user needs; Writing code; Testing software; Deploying applications
9174876,Question 19,"<link rel=""stylesheet"" href=""https://instructure-uploads.s3.amazonaws.com/account_73010000000000001/attachments/24286017/dp_app.css"">What does the term 'refactoring' refer to?<script src=""https://instructure-uploads.s3.amazonaws.com/account_73010000000000001/attachments/24286016/dp_app.js""></script>",Improving code structure without changing its behavior; Adding new features; Ignoring bugs; Writing new code from scratch
9174877,Question 20,"<link rel=""stylesheet"" href=""https://instructure-uploads.s3.amazonaws.com/account_73010000000000001/attachments/24286017/dp_app.css"">What is the significance of Agile methodologies?<script src=""https://instructure-uploads.s3.amazonaws.com/account_73010000000000001/attachments/24286016/dp_app.js""></script>",They enhance collaboration and responsiveness; They focus on rigid processes; They ignore user feedback; They reduce team interaction
9174878,Question 21,"<link rel=""stylesheet"" href=""https://instructure-uploads.s3.amazonaws.com/account_73010000000000001/attachments/24286017/dp_app.css"">What is the role of a deployment pipeline?<script src=""https://instructure-uploads.s3.amazonaws.com/account_73010000000000001/attachments/24286016/dp_app.js""></script>",To automate software delivery processes; To write code; To test software; To manage databases
9174879,Question 22,"<link rel=""stylesheet"" href=""https://instructure-uploads.s3.amazonaws.com/account_73010000000000001/attachments/24286017/dp_app.css"">What is the importance of clean code practices?<script src=""https://instructure-uploads.s3.amazonaws.com/account_73010000000000001/attachments/24286016/dp_app.js""></script>",To maintain code quality and ease of modification; To complicate the codebase; To ignore user needs; To reduce documentation
9174880,Question 23,"<link rel=""stylesheet"" href=""https://instructure-uploads.s3.amazonaws.com/account_73010000000000001/attachments/24286017/dp_app.css"">What does the term 'polymorphism' refer to in OOP?<script src=""https://instructure-uploads.s3.amazonaws.com/account_73010000000000001/attachments/24286016/dp_app.js""></script>",The ability to treat objects as instances of their parent class; The use of global variables; The creation of static methods; The elimination of classes
9174881,Question 24,"<link rel=""stylesheet"" href=""https://instructure-uploads.s3.amazonaws.com/account_73010000000000001/attachments/24286017/dp_app.css"">What is the purpose of Agile Team Role Assessment?<script src=""https://instructure-uploads.s3.amazonaws.com/account_73010000000000001/attachments/24286016/dp_app.js""></script>",To evaluate understanding of roles within a Scrum team; To ignore team dynamics; To focus solely on coding; To reduce collaboration
9174882,Question 25,"<link rel=""stylesheet"" href=""https://instructure-uploads.s3.amazonaws.com/account_73010000000000001/attachments/24286017/dp_app.css"">What is the significance of Kanban in Software Engineering?<script src=""https://instructure-uploads.s3.amazonaws.com/account_73010000000000001/attachments/24286016/dp_app.js""></script>",To enhance workflow efficiency; To complicate processes; To ignore user feedback; To reduce team interaction
9174883,Question 26,"<link rel=""stylesheet"" href=""https://instructure-uploads.s3.amazonaws.com/account_73010000000000001/attachments/24286017/dp_app.css"">What is the primary focus of Software Engineering?<script src=""https://instructure-uploads.s3.amazonaws.com/account_73010000000000001/attachments/24286016/dp_app.js""></script>",Systematic approach to software development; Random coding practices; Only testing software; Ignoring user requirements
9174884,Question 27,"<link rel=""stylesheet"" href=""https://instructure-uploads.s3.amazonaws.com/account_73010000000000001/attachments/24286017/dp_app.css"">What does the Software Development Life Cycle (SDLC) encompass?<script src=""https://instructure-uploads.s3.amazonaws.com/account_73010000000000001/attachments/24286016/dp_app.js""></script>","Only coding; Requirements gathering, design, implementation, testing, maintenance; User feedback only; Deployment only"
9174885,Question 28,"<link rel=""stylesheet"" href=""https://instructure-uploads.s3.amazonaws.com/account_73010000000000001/attachments/24286017/dp_app.css"">What are Functional Requirements?<script src=""https://instructure-uploads.s3.amazonaws.com/account_73010000000000001/attachments/24286016/dp_app.js""></script>",What the system should do; How the system performs; User interface design; None of the above
9174886,Question 29,"<link rel=""stylesheet"" href=""https://instructure-uploads.s3.amazonaws.com/account_73010000000000001/attachments/24286017/dp_app.css"">What are Non-Functional Requirements?<script src=""https://instructure-uploads.s3.amazonaws.com/account_73010000000000001/attachments/24286016/dp_app.js""></script>",What the system should do; How the system performs; User interface design; None of the above
9174887,Question 30,"<link rel=""stylesheet"" href=""https://instructure-uploads.s3.amazonaws.com/account_73010000000000001/attachments/24286017/dp_app.css"">What is Agile Development?<script src=""https://instructure-uploads.s3.amazonaws.com/account_73010000000000001/attachments/24286016/dp_app.js""></script>",A rigid development process; Emphasizes flexibility and collaboration; Only focuses on documentation; Ignores user feedback
9174888,Question 31,"<link rel=""stylesheet"" href=""https://instructure-uploads.s3.amazonaws.com/account_73010000000000001/attachments/24286017/dp_app.css"">What is Defensive Programming?<script src=""https://instructure-uploads.s3.amazonaws.com/account_73010000000000001/attachments/24286016/dp_app.js""></script>",Ignoring potential errors; Anticipating potential errors; Only focusing on performance; None of the above
9174889,Question 32,"<link rel=""stylesheet"" href=""https://instructure-uploads.s3.amazonaws.com/account_73010000000000001/attachments/24286017/dp_app.css"">What is the purpose of Software Testing?<script src=""https://instructure-uploads.s3.amazonaws.com/account_73010000000000001/attachments/24286016/dp_app.js""></script>",To ensure software meets requirements; To ignore defects; To only check performance; None of the above
9174890,Question 33,"<link rel=""stylesheet"" href=""https://instructure-uploads.s3.amazonaws.com/account_73010000000000001/attachments/24286017/dp_app.css"">What does Requirements Engineering involve?<script src=""https://instructure-uploads.s3.amazonaws.com/account_73010000000000001/attachments/24286016/dp_app.js""></script>","Ignoring user needs; Defining, documenting, and maintaining requirements; Only coding; Testing software"
9174891,Question 34,"<link rel=""stylesheet"" href=""https://instructure-uploads.s3.amazonaws.com/account_73010000000000001/attachments/24286017/dp_app.css"">What is the significance of Documentation in Software Engineering?<script src=""https://instructure-uploads.s3.amazonaws.com/account_73010000000000001/attachments/24286016/dp_app.js""></script>",It is not important; It provides essential information about software; It only serves as a reference for developers; None of the above
9174892,Question 35,"<link rel=""stylesheet"" href=""https://instructure-uploads.s3.amazonaws.com/account_73010000000000001/attachments/24286017/dp_app.css"">What is the Object-Oriented Paradigm?<script src=""https://instructure-uploads.s3.amazonaws.com/account_73010000000000001/attachments/24286016/dp_app.js""></script>",A method of coding without structure; Emphasizes the use of objects; Only focuses on data; None of the above
9174893,Question 36,"<link rel=""stylesheet"" href=""https://instructure-uploads.s3.amazonaws.com/account_73010000000000001/attachments/24286017/dp_app.css"">What is the role of Version Control in Software Engineering?<script src=""https://instructure-uploads.s3.amazonaws.com/account_73010000000000001/attachments/24286016/dp_app.js""></script>",To track changes in code; To ignore code changes; To only focus on testing; None of the above
9174894,Question 37,"<link rel=""stylesheet"" href=""https://instructure-uploads.s3.amazonaws.com/account_73010000000000001/attachments/24286017/dp_app.css"">What is the importance of User Requirements?<script src=""https://instructure-uploads.s3.amazonaws.com/account_73010000000000001/attachments/24286016/dp_app.js""></script>",They are not important; They help bridge the gap between technical specifications and user satisfaction; They only focus on performance; None of the above
9174895,Question 38,"<link rel=""stylesheet"" href=""https://instructure-uploads.s3.amazonaws.com/account_73010000000000001/attachments/24286017/dp_app.css"">What is the purpose of Software Refactoring?<script src=""https://instructure-uploads.s3.amazonaws.com/account_73010000000000001/attachments/24286016/dp_app.js""></script>",To improve code quality without changing its external behavior; To ignore code quality; To only focus on new features; None of the above
9174896,Question 39,"<link rel=""stylesheet"" href=""https://instructure-uploads.s3.amazonaws.com/account_73010000000000001/attachments/24286017/dp_app.css"">What is the significance of Testing Strategies?<script src=""https://instructure-uploads.s3.amazonaws.com/account_73010000000000001/attachments/24286016/dp_app.js""></script>",To outline the approach for creating test cases; To ignore bugs; To only focus on performance; None of the above
9174897,Question 40,"<link rel=""stylesheet"" href=""https://instructure-uploads.s3.amazonaws.com/account_73010000000000001/attachments/24286017/dp_app.css"">What does the term 'Quality Assurance' refer to in Software Engineering?<script src=""https://instructure-uploads.s3.amazonaws.com/account_73010000000000001/attachments/24286016/dp_app.js""></script>",Ensuring software meets specified requirements; Ignoring user feedback; Only focusing on coding; None of the above
9174898,Question 41,"<link rel=""stylesheet"" href=""https://instructure-uploads.s3.amazonaws.com/account_73010000000000001/attachments/24286017/dp_app.css"">Software Engineering encompasses a systematic approach to software development.<script src=""https://instructure-uploads.s3.amazonaws.com/account_73010000000000001/attachments/24286016/dp_app.js""></script>",TRUE; FALSE
9174899,Question 42,"<link rel=""stylesheet"" href=""https://instructure-uploads.s3.amazonaws.com/account_73010000000000001/attachments/24286017/dp_app.css"">The Software Development Life Cycle (SDLC) includes stages such as requirements gathering, design, implementation, verification, and maintenance.<script src=""https://instructure-uploads.s3.amazonaws.com/account_73010000000000001/attachments/24286016/dp_app.js""></script>",TRUE; FALSE
9174900,Question 43,"<link rel=""stylesheet"" href=""https://instructure-uploads.s3.amazonaws.com/account_73010000000000001/attachments/24286017/dp_app.css"">Functional Requirements specify how the system performs its functions.<script src=""https://instructure-uploads.s3.amazonaws.com/account_73010000000000001/attachments/24286016/dp_app.js""></script>",TRUE; FALSE
9174901,Question 44,"<link rel=""stylesheet"" href=""https://instructure-uploads.s3.amazonaws.com/account_73010000000000001/attachments/24286017/dp_app.css"">Agile Development emphasizes flexibility and collaboration among team members.<script src=""https://instructure-uploads.s3.amazonaws.com/account_73010000000000001/attachments/24286016/dp_app.js""></script>",TRUE; FALSE
9174902,Question 45,"<link rel=""stylesheet"" href=""https://instructure-uploads.s3.amazonaws.com/account_73010000000000001/attachments/24286017/dp_app.css"">Quality assurance is not a critical principle in software engineering.<script src=""https://instructure-uploads.s3.amazonaws.com/account_73010000000000001/attachments/24286016/dp_app.js""></script>",TRUE; FALSE
9174903,Question 46,"<link rel=""stylesheet"" href=""https://instructure-uploads.s3.amazonaws.com/account_73010000000000001/attachments/24286017/dp_app.css"">Defensive Programming anticipates potential errors in software.<script src=""https://instructure-uploads.s3.amazonaws.com/account_73010000000000001/attachments/24286016/dp_app.js""></script>",TRUE; FALSE
9174904,Question 47,"<link rel=""stylesheet"" href=""https://instructure-uploads.s3.amazonaws.com/account_73010000000000001/attachments/24286017/dp_app.css"">Software Testing is a vital process that ensures software applications meet specified requirements.<script src=""https://instructure-uploads.s3.amazonaws.com/account_73010000000000001/attachments/24286016/dp_app.js""></script>",TRUE; FALSE
9174905,Question 48,"<link rel=""stylesheet"" href=""https://instructure-uploads.s3.amazonaws.com/account_73010000000000001/attachments/24286017/dp_app.css"">Documentation is an unimportant element in software engineering.<script src=""https://instructure-uploads.s3.amazonaws.com/account_73010000000000001/attachments/24286016/dp_app.js""></script>",TRUE; FALSE
9174906,Question 49,"<link rel=""stylesheet"" href=""https://instructure-uploads.s3.amazonaws.com/account_73010000000000001/attachments/24286017/dp_app.css"">Version Control systems are essential for managing changes to source code.<script src=""https://instructure-uploads.s3.amazonaws.com/account_73010000000000001/attachments/24286016/dp_app.js""></script>",TRUE; FALSE
9174907,Question 50,"<link rel=""stylesheet"" href=""https://instructure-uploads.s3.amazonaws.com/account_73010000000000001/attachments/24286017/dp_app.css"">The principles of Object-Oriented Programming include encapsulation, inheritance, and polymorphism.<script src=""https://instructure-uploads.s3.amazonaws.com/account_73010000000000001/attachments/24286016/dp_app.js""></script>",TRUE; FALSE
9174908,Question 51,"<link rel=""stylesheet"" href=""https://instructure-uploads.s3.amazonaws.com/account_73010000000000001/attachments/24286017/dp_app.css"">What is a key feature of Python that makes it suitable for beginners?<script src=""https://instructure-uploads.s3.amazonaws.com/account_73010000000000001/attachments/24286016/dp_app.js""></script>",Complex syntax; Readability and simplicity; Limited libraries; High cost
9174909,Question 52,"<link rel=""stylesheet"" href=""https://instructure-uploads.s3.amazonaws.com/account_73010000000000001/attachments/24286017/dp_app.css"">Which library is commonly used for data manipulation in Python?<script src=""https://instructure-uploads.s3.amazonaws.com/account_73010000000000001/attachments/24286016/dp_app.js""></script>",Flask; NumPy; Pandas; Django
9174910,Question 53,"<link rel=""stylesheet"" href=""https://instructure-uploads.s3.amazonaws.com/account_73010000000000001/attachments/24286017/dp_app.css"">What programming paradigms does Python support?<script src=""https://instructure-uploads.s3.amazonaws.com/account_73010000000000001/attachments/24286016/dp_app.js""></script>","Only procedural; Only object-oriented; Procedural, object-oriented, and functional"
9174911,Question 54,"<link rel=""stylesheet"" href=""https://instructure-uploads.s3.amazonaws.com/account_73010000000000001/attachments/24286017/dp_app.css"">Which framework is used for web development in Python?<script src=""https://instructure-uploads.s3.amazonaws.com/account_73010000000000001/attachments/24286016/dp_app.js""></script>",TensorFlow; Pandas; Flask; NumPy
9174912,Question 55,"<link rel=""stylesheet"" href=""https://instructure-uploads.s3.amazonaws.com/account_73010000000000001/attachments/24286017/dp_app.css"">What is the significance of Python's extensive libraries?<script src=""https://instructure-uploads.s3.amazonaws.com/account_73010000000000001/attachments/24286016/dp_app.js""></script>",They complicate programming; They enhance functionality and efficiency; They are not widely used; They are only for data science
9174913,Question 56,"<link rel=""stylesheet"" href=""https://instructure-uploads.s3.amazonaws.com/account_73010000000000001/attachments/24286017/dp_app.css"">Which library is used for machine learning in Python?<script src=""https://instructure-uploads.s3.amazonaws.com/account_73010000000000001/attachments/24286016/dp_app.js""></script>",Flask; Scikit-learn; Django; Pandas
9174914,Question 57,"<link rel=""stylesheet"" href=""https://instructure-uploads.s3.amazonaws.com/account_73010000000000001/attachments/24286017/dp_app.css"">What is a primary use of Python in data science?<script src=""https://instructure-uploads.s3.amazonaws.com/account_73010000000000001/attachments/24286016/dp_app.js""></script>",Web development; Data manipulation and analysis; Game development; Mobile app development
9174915,Question 58,"<link rel=""stylesheet"" href=""https://instructure-uploads.s3.amazonaws.com/account_73010000000000001/attachments/24286017/dp_app.css"">What is the role of functions in Python programming?<script src=""https://instructure-uploads.s3.amazonaws.com/account_73010000000000001/attachments/24286016/dp_app.js""></script>",They are not important; They allow code reuse and organization; They slow down the program; They are only for beginners
9174916,Question 59,"<link rel=""stylesheet"" href=""https://instructure-uploads.s3.amazonaws.com/account_73010000000000001/attachments/24286017/dp_app.css"">Which version of Python introduced significant advancements?<script src=""https://instructure-uploads.s3.amazonaws.com/account_73010000000000001/attachments/24286016/dp_app.js""></script>",Python 2.7; Python 3.6; Python 3.9; Python 4.0
9174917,Question 60,"<link rel=""stylesheet"" href=""https://instructure-uploads.s3.amazonaws.com/account_73010000000000001/attachments/24286017/dp_app.css"">What is the purpose of IDLE in Python?<script src=""https://instructure-uploads.s3.amazonaws.com/account_73010000000000001/attachments/24286016/dp_app.js""></script>",To create web applications; To serve as an integrated development environment; To manage databases; To compile C code
