id,title,question_text,choices
9174427,Question 1,"<link rel=""stylesheet"" href=""https://instructure-uploads.s3.amazonaws.com/account_73010000000000001/attachments/24286017/dp_app.css"">What is the primary focus of Software Engineering?<script src=""https://instructure-uploads.s3.amazonaws.com/account_73010000000000001/attachments/24286016/dp_app.js""></script>",Developing high-quality software systems; Creating hardware components; Managing databases; Designing user interfaces; questions_194051020325.csv
9174428,Question 2,"<link rel=""stylesheet"" href=""https://instructure-uploads.s3.amazonaws.com/account_73010000000000001/attachments/24286017/dp_app.css"">Which of the following is a key principle of Software Engineering?<script src=""https://instructure-uploads.s3.amazonaws.com/account_73010000000000001/attachments/24286016/dp_app.js""></script>",Agility; Randomness; Chaos; Simplicity; questions_194051020325.csv
9174429,Question 3,"<link rel=""stylesheet"" href=""https://instructure-uploads.s3.amazonaws.com/account_73010000000000001/attachments/24286017/dp_app.css"">What does the Software Development Life Cycle (SDLC) encompass?<script src=""https://instructure-uploads.s3.amazonaws.com/account_73010000000000001/attachments/24286016/dp_app.js""></script>","Only coding; Planning, design, implementation, testing, and maintenance; Only testing; Only requirements gathering; questions_194051020325.csv"
9174430,Question 4,"<link rel=""stylesheet"" href=""https://instructure-uploads.s3.amazonaws.com/account_73010000000000001/attachments/24286017/dp_app.css"">What is the purpose of requirements elicitation in Software Engineering?<script src=""https://instructure-uploads.s3.amazonaws.com/account_73010000000000001/attachments/24286016/dp_app.js""></script>",To gather and define stakeholder needs; To write code; To test software; To deploy applications; questions_194051020325.csv
9174431,Question 5,"<link rel=""stylesheet"" href=""https://instructure-uploads.s3.amazonaws.com/account_73010000000000001/attachments/24286017/dp_app.css"">Which methodology emphasizes iterative development and flexibility?<script src=""https://instructure-uploads.s3.amazonaws.com/account_73010000000000001/attachments/24286016/dp_app.js""></script>",Waterfall; Agile; Spiral; V-Model; questions_194051020325.csv
9174432,Question 6,"<link rel=""stylesheet"" href=""https://instructure-uploads.s3.amazonaws.com/account_73010000000000001/attachments/24286017/dp_app.css"">What is defensive programming?<script src=""https://instructure-uploads.s3.amazonaws.com/account_73010000000000001/attachments/24286016/dp_app.js""></script>",A method to anticipate potential errors; A way to write code without testing; A technique to ignore user feedback; A method to speed up coding; questions_194051020325.csv
9174433,Question 7,"<link rel=""stylesheet"" href=""https://instructure-uploads.s3.amazonaws.com/account_73010000000000001/attachments/24286017/dp_app.css"">What is the significance of software testing?<script src=""https://instructure-uploads.s3.amazonaws.com/account_73010000000000001/attachments/24286016/dp_app.js""></script>",To ensure software meets requirements and is defect-free; To increase software size; To reduce software costs; To eliminate documentation; questions_194051020325.csv
9174434,Question 8,"<link rel=""stylesheet"" href=""https://instructure-uploads.s3.amazonaws.com/account_73010000000000001/attachments/24286017/dp_app.css"">What does Agile Development promote?<script src=""https://instructure-uploads.s3.amazonaws.com/account_73010000000000001/attachments/24286016/dp_app.js""></script>",Flexibility and collaboration; Strict adherence to plans; Isolation of team members; Minimizing user feedback; questions_194051020325.csv
9174435,Question 9,"<link rel=""stylesheet"" href=""https://instructure-uploads.s3.amazonaws.com/account_73010000000000001/attachments/24286017/dp_app.css"">What is the role of quality assurance in Software Engineering?<script src=""https://instructure-uploads.s3.amazonaws.com/account_73010000000000001/attachments/24286016/dp_app.js""></script>",To ensure software meets specified requirements; To ignore user needs; To focus solely on coding; To reduce project timelines; questions_194051020325.csv
9174436,Question 10,"<link rel=""stylesheet"" href=""https://instructure-uploads.s3.amazonaws.com/account_73010000000000001/attachments/24286017/dp_app.css"">What is encapsulation in Object-Oriented Programming?<script src=""https://instructure-uploads.s3.amazonaws.com/account_73010000000000001/attachments/24286016/dp_app.js""></script>",Hiding data and methods within a class; Sharing data across classes; Creating global variables; Using only public methods; questions_194051020325.csv
9174437,Question 11,"<link rel=""stylesheet"" href=""https://instructure-uploads.s3.amazonaws.com/account_73010000000000001/attachments/24286017/dp_app.css"">What is the purpose of version control systems?<script src=""https://instructure-uploads.s3.amazonaws.com/account_73010000000000001/attachments/24286016/dp_app.js""></script>",To track changes in code; To write code faster; To eliminate bugs; To manage hardware; questions_194051020325.csv
9174438,Question 12,"<link rel=""stylesheet"" href=""https://instructure-uploads.s3.amazonaws.com/account_73010000000000001/attachments/24286017/dp_app.css"">What does the design stage in the SDLC involve?<script src=""https://instructure-uploads.s3.amazonaws.com/account_73010000000000001/attachments/24286016/dp_app.js""></script>",Translating requirements into a blueprint; Writing code; Testing software; Deploying applications; questions_194051020325.csv
9174439,Question 13,"<link rel=""stylesheet"" href=""https://instructure-uploads.s3.amazonaws.com/account_73010000000000001/attachments/24286017/dp_app.css"">What is the importance of documentation in Software Engineering?<script src=""https://instructure-uploads.s3.amazonaws.com/account_73010000000000001/attachments/24286016/dp_app.js""></script>",To provide essential information about software; To confuse users; To reduce coding time; To eliminate testing; questions_194051020325.csv
9174440,Question 14,"<link rel=""stylesheet"" href=""https://instructure-uploads.s3.amazonaws.com/account_73010000000000001/attachments/24286017/dp_app.css"">What is the role of UML diagrams?<script src=""https://instructure-uploads.s3.amazonaws.com/account_73010000000000001/attachments/24286016/dp_app.js""></script>",To visually represent software design; To write code; To test software; To manage databases; questions_194051020325.csv
9174441,Question 15,"<link rel=""stylesheet"" href=""https://instructure-uploads.s3.amazonaws.com/account_73010000000000001/attachments/24286017/dp_app.css"">What is the significance of non-functional requirements?<script src=""https://instructure-uploads.s3.amazonaws.com/account_73010000000000001/attachments/24286016/dp_app.js""></script>",They impact performance and usability; They are not important; They only relate to coding; They are only for testing; questions_194051020325.csv
9174442,Question 16,"<link rel=""stylesheet"" href=""https://instructure-uploads.s3.amazonaws.com/account_73010000000000001/attachments/24286017/dp_app.css"">What does modularity in software design promote?<script src=""https://instructure-uploads.s3.amazonaws.com/account_73010000000000001/attachments/24286016/dp_app.js""></script>",Breaking down software into manageable components; Creating monolithic applications; Ignoring user feedback; Reducing testing; questions_194051020325.csv
9174443,Question 17,"<link rel=""stylesheet"" href=""https://instructure-uploads.s3.amazonaws.com/account_73010000000000001/attachments/24286017/dp_app.css"">What is the purpose of unit testing?<script src=""https://instructure-uploads.s3.amazonaws.com/account_73010000000000001/attachments/24286016/dp_app.js""></script>",To evaluate individual components of code; To test the entire application; To ignore bugs; To speed up development; questions_194051020325.csv
9174444,Question 18,"<link rel=""stylesheet"" href=""https://instructure-uploads.s3.amazonaws.com/account_73010000000000001/attachments/24286017/dp_app.css"">What is the Agile Manifesto?<script src=""https://instructure-uploads.s3.amazonaws.com/account_73010000000000001/attachments/24286016/dp_app.js""></script>",A set of principles for Agile development; A coding standard; A testing framework; A project management tool; questions_194051020325.csv
9174445,Question 19,"<link rel=""stylesheet"" href=""https://instructure-uploads.s3.amazonaws.com/account_73010000000000001/attachments/24286017/dp_app.css"">What is the focus of Software Requirements Engineering?<script src=""https://instructure-uploads.s3.amazonaws.com/account_73010000000000001/attachments/24286016/dp_app.js""></script>",Defining and documenting user needs; Writing code; Testing software; Deploying applications; questions_194051020325.csv
9174446,Question 20,"<link rel=""stylesheet"" href=""https://instructure-uploads.s3.amazonaws.com/account_73010000000000001/attachments/24286017/dp_app.css"">What does the term 'refactoring' refer to?<script src=""https://instructure-uploads.s3.amazonaws.com/account_73010000000000001/attachments/24286016/dp_app.js""></script>",Improving code structure without changing its behavior; Adding new features; Ignoring bugs; Writing new code from scratch; questions_194051020325.csv
9174447,Question 21,"<link rel=""stylesheet"" href=""https://instructure-uploads.s3.amazonaws.com/account_73010000000000001/attachments/24286017/dp_app.css"">What is the significance of Agile methodologies?<script src=""https://instructure-uploads.s3.amazonaws.com/account_73010000000000001/attachments/24286016/dp_app.js""></script>",They enhance collaboration and responsiveness; They focus on rigid processes; They ignore user feedback; They reduce team interaction; questions_194051020325.csv
9174448,Question 22,"<link rel=""stylesheet"" href=""https://instructure-uploads.s3.amazonaws.com/account_73010000000000001/attachments/24286017/dp_app.css"">What is the role of a deployment pipeline?<script src=""https://instructure-uploads.s3.amazonaws.com/account_73010000000000001/attachments/24286016/dp_app.js""></script>",To automate software delivery processes; To write code; To test software; To manage databases; questions_194051020325.csv
9174449,Question 23,"<link rel=""stylesheet"" href=""https://instructure-uploads.s3.amazonaws.com/account_73010000000000001/attachments/24286017/dp_app.css"">What is the importance of clean code practices?<script src=""https://instructure-uploads.s3.amazonaws.com/account_73010000000000001/attachments/24286016/dp_app.js""></script>",To maintain code quality and ease of modification; To complicate the codebase; To ignore user needs; To reduce documentation; questions_194051020325.csv
9174450,Question 24,"<link rel=""stylesheet"" href=""https://instructure-uploads.s3.amazonaws.com/account_73010000000000001/attachments/24286017/dp_app.css"">What does the term 'polymorphism' refer to in OOP?<script src=""https://instructure-uploads.s3.amazonaws.com/account_73010000000000001/attachments/24286016/dp_app.js""></script>",The ability to treat objects as instances of their parent class; The use of global variables; The creation of static methods; The elimination of classes; questions_194051020325.csv
9174451,Question 25,"<link rel=""stylesheet"" href=""https://instructure-uploads.s3.amazonaws.com/account_73010000000000001/attachments/24286017/dp_app.css"">What is the purpose of Agile Team Role Assessment?<script src=""https://instructure-uploads.s3.amazonaws.com/account_73010000000000001/attachments/24286016/dp_app.js""></script>",To evaluate understanding of roles within a Scrum team; To ignore team dynamics; To focus solely on coding; To reduce collaboration; questions_194051020325.csv
9174452,Question 26,"<link rel=""stylesheet"" href=""https://instructure-uploads.s3.amazonaws.com/account_73010000000000001/attachments/24286017/dp_app.css"">What is the significance of Kanban in Software Engineering?<script src=""https://instructure-uploads.s3.amazonaws.com/account_73010000000000001/attachments/24286016/dp_app.js""></script>",To enhance workflow efficiency; To complicate processes; To ignore user feedback; To reduce team interaction; questions_194051020325.csv
9174453,Question 27,"<link rel=""stylesheet"" href=""https://instructure-uploads.s3.amazonaws.com/account_73010000000000001/attachments/24286017/dp_app.css"">What is the primary focus of Software Engineering?<script src=""https://instructure-uploads.s3.amazonaws.com/account_73010000000000001/attachments/24286016/dp_app.js""></script>",Systematic approach to software development; Random coding practices; Only testing software; Ignoring user requirements; questions_194133020325.csv
9174454,Question 28,"<link rel=""stylesheet"" href=""https://instructure-uploads.s3.amazonaws.com/account_73010000000000001/attachments/24286017/dp_app.css"">What does the Software Development Life Cycle (SDLC) encompass?<script src=""https://instructure-uploads.s3.amazonaws.com/account_73010000000000001/attachments/24286016/dp_app.js""></script>","Only coding; Requirements gathering, design, implementation, testing, maintenance; User feedback only; Deployment only; questions_194133020325.csv"
9174455,Question 29,"<link rel=""stylesheet"" href=""https://instructure-uploads.s3.amazonaws.com/account_73010000000000001/attachments/24286017/dp_app.css"">What are Functional Requirements?<script src=""https://instructure-uploads.s3.amazonaws.com/account_73010000000000001/attachments/24286016/dp_app.js""></script>",What the system should do; How the system performs; User interface design; None of the above; questions_194133020325.csv
9174456,Question 30,"<link rel=""stylesheet"" href=""https://instructure-uploads.s3.amazonaws.com/account_73010000000000001/attachments/24286017/dp_app.css"">What are Non-Functional Requirements?<script src=""https://instructure-uploads.s3.amazonaws.com/account_73010000000000001/attachments/24286016/dp_app.js""></script>",What the system should do; How the system performs; User interface design; None of the above; questions_194133020325.csv
9174457,Question 31,"<link rel=""stylesheet"" href=""https://instructure-uploads.s3.amazonaws.com/account_73010000000000001/attachments/24286017/dp_app.css"">What is Agile Development?<script src=""https://instructure-uploads.s3.amazonaws.com/account_73010000000000001/attachments/24286016/dp_app.js""></script>",A rigid development process; Emphasizes flexibility and collaboration; Only focuses on documentation; Ignores user feedback; questions_194133020325.csv
9174458,Question 32,"<link rel=""stylesheet"" href=""https://instructure-uploads.s3.amazonaws.com/account_73010000000000001/attachments/24286017/dp_app.css"">What is Defensive Programming?<script src=""https://instructure-uploads.s3.amazonaws.com/account_73010000000000001/attachments/24286016/dp_app.js""></script>",Ignoring potential errors; Anticipating potential errors; Only focusing on performance; None of the above; questions_194133020325.csv
9174459,Question 33,"<link rel=""stylesheet"" href=""https://instructure-uploads.s3.amazonaws.com/account_73010000000000001/attachments/24286017/dp_app.css"">What is the purpose of Software Testing?<script src=""https://instructure-uploads.s3.amazonaws.com/account_73010000000000001/attachments/24286016/dp_app.js""></script>",To ensure software meets requirements; To ignore defects; To only check performance; None of the above; questions_194133020325.csv
9174460,Question 34,"<link rel=""stylesheet"" href=""https://instructure-uploads.s3.amazonaws.com/account_73010000000000001/attachments/24286017/dp_app.css"">What does Requirements Engineering involve?<script src=""https://instructure-uploads.s3.amazonaws.com/account_73010000000000001/attachments/24286016/dp_app.js""></script>","Ignoring user needs; Defining, documenting, and maintaining requirements; Only coding; Testing software; questions_194133020325.csv"
9174461,Question 35,"<link rel=""stylesheet"" href=""https://instructure-uploads.s3.amazonaws.com/account_73010000000000001/attachments/24286017/dp_app.css"">What is the significance of Documentation in Software Engineering?<script src=""https://instructure-uploads.s3.amazonaws.com/account_73010000000000001/attachments/24286016/dp_app.js""></script>",It is not important; It provides essential information about software; It only serves as a reference for developers; None of the above; questions_194133020325.csv
9174462,Question 36,"<link rel=""stylesheet"" href=""https://instructure-uploads.s3.amazonaws.com/account_73010000000000001/attachments/24286017/dp_app.css"">What is the Object-Oriented Paradigm?<script src=""https://instructure-uploads.s3.amazonaws.com/account_73010000000000001/attachments/24286016/dp_app.js""></script>",A method of coding without structure; Emphasizes the use of objects; Only focuses on data; None of the above; questions_194133020325.csv
9174463,Question 37,"<link rel=""stylesheet"" href=""https://instructure-uploads.s3.amazonaws.com/account_73010000000000001/attachments/24286017/dp_app.css"">What is the role of Version Control in Software Engineering?<script src=""https://instructure-uploads.s3.amazonaws.com/account_73010000000000001/attachments/24286016/dp_app.js""></script>",To track changes in code; To ignore code changes; To only focus on testing; None of the above; questions_194133020325.csv
9174464,Question 38,"<link rel=""stylesheet"" href=""https://instructure-uploads.s3.amazonaws.com/account_73010000000000001/attachments/24286017/dp_app.css"">What is the importance of User Requirements?<script src=""https://instructure-uploads.s3.amazonaws.com/account_73010000000000001/attachments/24286016/dp_app.js""></script>",They are not important; They help bridge the gap between technical specifications and user satisfaction; They only focus on performance; None of the above; questions_194133020325.csv
9174465,Question 39,"<link rel=""stylesheet"" href=""https://instructure-uploads.s3.amazonaws.com/account_73010000000000001/attachments/24286017/dp_app.css"">What is the purpose of Software Refactoring?<script src=""https://instructure-uploads.s3.amazonaws.com/account_73010000000000001/attachments/24286016/dp_app.js""></script>",To improve code quality without changing its external behavior; To ignore code quality; To only focus on new features; None of the above; questions_194133020325.csv
9174466,Question 40,"<link rel=""stylesheet"" href=""https://instructure-uploads.s3.amazonaws.com/account_73010000000000001/attachments/24286017/dp_app.css"">What is the significance of Testing Strategies?<script src=""https://instructure-uploads.s3.amazonaws.com/account_73010000000000001/attachments/24286016/dp_app.js""></script>",To outline the approach for creating test cases; To ignore bugs; To only focus on performance; None of the above; questions_194133020325.csv
9174467,Question 41,"<link rel=""stylesheet"" href=""https://instructure-uploads.s3.amazonaws.com/account_73010000000000001/attachments/24286017/dp_app.css"">What does the term 'Quality Assurance' refer to in Software Engineering?<script src=""https://instructure-uploads.s3.amazonaws.com/account_73010000000000001/attachments/24286016/dp_app.js""></script>",Ensuring software meets specified requirements; Ignoring user feedback; Only focusing on coding; None of the above; questions_194133020325.csv
9174468,Question 42,"<link rel=""stylesheet"" href=""https://instructure-uploads.s3.amazonaws.com/account_73010000000000001/attachments/24286017/dp_app.css"">Software Engineering encompasses a systematic approach to software development.<script src=""https://instructure-uploads.s3.amazonaws.com/account_73010000000000001/attachments/24286016/dp_app.js""></script>",TRUE; FALSE; questions_194245020325.csv
9174469,Question 43,"<link rel=""stylesheet"" href=""https://instructure-uploads.s3.amazonaws.com/account_73010000000000001/attachments/24286017/dp_app.css"">The Software Development Life Cycle (SDLC) includes stages such as requirements gathering, design, implementation, verification, and maintenance.<script src=""https://instructure-uploads.s3.amazonaws.com/account_73010000000000001/attachments/24286016/dp_app.js""></script>",TRUE; FALSE; questions_194245020325.csv
9174470,Question 44,"<link rel=""stylesheet"" href=""https://instructure-uploads.s3.amazonaws.com/account_73010000000000001/attachments/24286017/dp_app.css"">Functional Requirements specify how the system performs its functions.<script src=""https://instructure-uploads.s3.amazonaws.com/account_73010000000000001/attachments/24286016/dp_app.js""></script>",TRUE; FALSE; questions_194245020325.csv
9174471,Question 45,"<link rel=""stylesheet"" href=""https://instructure-uploads.s3.amazonaws.com/account_73010000000000001/attachments/24286017/dp_app.css"">Agile Development emphasizes flexibility and collaboration among team members.<script src=""https://instructure-uploads.s3.amazonaws.com/account_73010000000000001/attachments/24286016/dp_app.js""></script>",TRUE; FALSE; questions_194245020325.csv
9174472,Question 46,"<link rel=""stylesheet"" href=""https://instructure-uploads.s3.amazonaws.com/account_73010000000000001/attachments/24286017/dp_app.css"">Quality assurance is not a critical principle in software engineering.<script src=""https://instructure-uploads.s3.amazonaws.com/account_73010000000000001/attachments/24286016/dp_app.js""></script>",TRUE; FALSE; questions_194245020325.csv
9174473,Question 47,"<link rel=""stylesheet"" href=""https://instructure-uploads.s3.amazonaws.com/account_73010000000000001/attachments/24286017/dp_app.css"">Defensive Programming anticipates potential errors in software.<script src=""https://instructure-uploads.s3.amazonaws.com/account_73010000000000001/attachments/24286016/dp_app.js""></script>",TRUE; FALSE; questions_194245020325.csv
9174474,Question 48,"<link rel=""stylesheet"" href=""https://instructure-uploads.s3.amazonaws.com/account_73010000000000001/attachments/24286017/dp_app.css"">Software Testing is a vital process that ensures software applications meet specified requirements.<script src=""https://instructure-uploads.s3.amazonaws.com/account_73010000000000001/attachments/24286016/dp_app.js""></script>",TRUE; FALSE; questions_194245020325.csv
9174475,Question 49,"<link rel=""stylesheet"" href=""https://instructure-uploads.s3.amazonaws.com/account_73010000000000001/attachments/24286017/dp_app.css"">Documentation is an unimportant element in software engineering.<script src=""https://instructure-uploads.s3.amazonaws.com/account_73010000000000001/attachments/24286016/dp_app.js""></script>",TRUE; FALSE; questions_194245020325.csv
9174476,Question 50,"<link rel=""stylesheet"" href=""https://instructure-uploads.s3.amazonaws.com/account_73010000000000001/attachments/24286017/dp_app.css"">Version Control systems are essential for managing changes to source code.<script src=""https://instructure-uploads.s3.amazonaws.com/account_73010000000000001/attachments/24286016/dp_app.js""></script>",TRUE; FALSE; questions_194245020325.csv
9174477,Question 51,"<link rel=""stylesheet"" href=""https://instructure-uploads.s3.amazonaws.com/account_73010000000000001/attachments/24286017/dp_app.css"">The principles of Object-Oriented Programming include encapsulation, inheritance, and polymorphism.<script src=""https://instructure-uploads.s3.amazonaws.com/account_73010000000000001/attachments/24286016/dp_app.js""></script>",TRUE; FALSE; questions_194245020325.csv
9174478,Question 52,"<link rel=""stylesheet"" href=""https://instructure-uploads.s3.amazonaws.com/account_73010000000000001/attachments/24286017/dp_app.css"">What is a key feature of Python that makes it suitable for beginners?<script src=""https://instructure-uploads.s3.amazonaws.com/account_73010000000000001/attachments/24286016/dp_app.js""></script>",Complex syntax; Readability and simplicity; Limited libraries; High cost; questions_194418020325.csv
9174479,Question 53,"<link rel=""stylesheet"" href=""https://instructure-uploads.s3.amazonaws.com/account_73010000000000001/attachments/24286017/dp_app.css"">Which library is commonly used for data manipulation in Python?<script src=""https://instructure-uploads.s3.amazonaws.com/account_73010000000000001/attachments/24286016/dp_app.js""></script>",Flask; NumPy; Pandas; Django; questions_194418020325.csv
9174480,Question 54,"<link rel=""stylesheet"" href=""https://instructure-uploads.s3.amazonaws.com/account_73010000000000001/attachments/24286017/dp_app.css"">What programming paradigms does Python support?<script src=""https://instructure-uploads.s3.amazonaws.com/account_73010000000000001/attachments/24286016/dp_app.js""></script>","Only procedural; Only object-oriented; Procedural, object-oriented, and functional; questions_194418020325.csv"
9174481,Question 55,"<link rel=""stylesheet"" href=""https://instructure-uploads.s3.amazonaws.com/account_73010000000000001/attachments/24286017/dp_app.css"">Which framework is used for web development in Python?<script src=""https://instructure-uploads.s3.amazonaws.com/account_73010000000000001/attachments/24286016/dp_app.js""></script>",TensorFlow; Pandas; Flask; NumPy; questions_194418020325.csv
9174482,Question 56,"<link rel=""stylesheet"" href=""https://instructure-uploads.s3.amazonaws.com/account_73010000000000001/attachments/24286017/dp_app.css"">What is the significance of Python's extensive libraries?<script src=""https://instructure-uploads.s3.amazonaws.com/account_73010000000000001/attachments/24286016/dp_app.js""></script>",They complicate programming; They enhance functionality and efficiency; They are not widely used; They are only for data science; questions_194418020325.csv
