id,title,question_text,choices
9175155,Question 298,"<link rel=""stylesheet"" href=""https://instructure-uploads.s3.amazonaws.com/account_73010000000000001/attachments/24286017/dp_app.css"">A primary key is used to:<script src=""https://instructure-uploads.s3.amazonaws.com/account_73010000000000001/attachments/24286016/dp_app.js""></script>",Create relationships between tables; Ensure unique identification of records; Store multiple values in a column; Define data types
9175156,Question 299,"<link rel=""stylesheet"" href=""https://instructure-uploads.s3.amazonaws.com/account_73010000000000001/attachments/24286017/dp_app.css"">Which SQL command is used to add new records to a table?<script src=""https://instructure-uploads.s3.amazonaws.com/account_73010000000000001/attachments/24286016/dp_app.js""></script>",SELECT; UPDATE; INSERT INTO; DELETE
9175157,Question 300,"<link rel=""stylesheet"" href=""https://instructure-uploads.s3.amazonaws.com/account_73010000000000001/attachments/24286017/dp_app.css"">True or False: Foreign keys are used to ensure data integrity by referencing primary keys in other tables.<script src=""https://instructure-uploads.s3.amazonaws.com/account_73010000000000001/attachments/24286016/dp_app.js""></script>",TRUE; FALSE
9175158,Question 301,"<link rel=""stylesheet"" href=""https://instructure-uploads.s3.amazonaws.com/account_73010000000000001/attachments/24286017/dp_app.css"">Which of the following is NOT a CRUD operation?<script src=""https://instructure-uploads.s3.amazonaws.com/account_73010000000000001/attachments/24286016/dp_app.js""></script>",Create; Read; Update; Join
9175159,Question 302,"<link rel=""stylesheet"" href=""https://instructure-uploads.s3.amazonaws.com/account_73010000000000001/attachments/24286017/dp_app.css"">What does normalization in databases aim to achieve?<script src=""https://instructure-uploads.s3.amazonaws.com/account_73010000000000001/attachments/24286016/dp_app.js""></script>",Increase redundancy; Reduce data integrity; Organize data efficiently; Simplify SQL commands
9175160,Question 303,"<link rel=""stylesheet"" href=""https://instructure-uploads.s3.amazonaws.com/account_73010000000000001/attachments/24286017/dp_app.css"">Which SQL clause is used to specify the columns to be returned in a query result?<script src=""https://instructure-uploads.s3.amazonaws.com/account_73010000000000001/attachments/24286016/dp_app.js""></script>",FROM; WHERE; SELECT; JOIN
9175161,Question 304,"<link rel=""stylesheet"" href=""https://instructure-uploads.s3.amazonaws.com/account_73010000000000001/attachments/24286017/dp_app.css"">True or False: A Database Management System (DBMS) is responsible for managing collections of data accessed by multiple users.<script src=""https://instructure-uploads.s3.amazonaws.com/account_73010000000000001/attachments/24286016/dp_app.js""></script>",TRUE; FALSE
9175162,Question 305,"<link rel=""stylesheet"" href=""https://instructure-uploads.s3.amazonaws.com/account_73010000000000001/attachments/24286017/dp_app.css"">Which of the following defines the kind of data that can be stored in each column?<script src=""https://instructure-uploads.s3.amazonaws.com/account_73010000000000001/attachments/24286016/dp_app.js""></script>",Data relationships; Data types; Normalization; CRUD operations
9175163,Question 306,"<link rel=""stylesheet"" href=""https://instructure-uploads.s3.amazonaws.com/account_73010000000000001/attachments/24286017/dp_app.css"">Which SQL command is used to modify existing records in a table?<script src=""https://instructure-uploads.s3.amazonaws.com/account_73010000000000001/attachments/24286016/dp_app.js""></script>",INSERT INTO; UPDATE; DELETE; SELECT
9175164,Question 307,"<link rel=""stylesheet"" href=""https://instructure-uploads.s3.amazonaws.com/account_73010000000000001/attachments/24286017/dp_app.css"">Which of the following operations is part of the CRUD framework?<script src=""https://instructure-uploads.s3.amazonaws.com/account_73010000000000001/attachments/24286016/dp_app.js""></script>",Create; Read; Update; All of the above
9175165,Question 308,"<link rel=""stylesheet"" href=""https://instructure-uploads.s3.amazonaws.com/account_73010000000000001/attachments/24286017/dp_app.css"">True or False: Data relationships are not important for accurate processing and reporting.<script src=""https://instructure-uploads.s3.amazonaws.com/account_73010000000000001/attachments/24286016/dp_app.js""></script>",TRUE; FALSE
9175166,Question 309,"<link rel=""stylesheet"" href=""https://instructure-uploads.s3.amazonaws.com/account_73010000000000001/attachments/24286017/dp_app.css"">What is the role of JOIN operations in SQL?<script src=""https://instructure-uploads.s3.amazonaws.com/account_73010000000000001/attachments/24286016/dp_app.js""></script>",To delete records; To combine data from multiple tables; To create new tables; To define data types
9175167,Question 310,"<link rel=""stylesheet"" href=""https://instructure-uploads.s3.amazonaws.com/account_73010000000000001/attachments/24286017/dp_app.css"">Which of the following is a benefit of normalization?<script src=""https://instructure-uploads.s3.amazonaws.com/account_73010000000000001/attachments/24286016/dp_app.js""></script>",Increased redundancy; Improved data integrity; Simplified data types; Faster SQL execution
9175168,Question 311,"<link rel=""stylesheet"" href=""https://instructure-uploads.s3.amazonaws.com/account_73010000000000001/attachments/24286017/dp_app.css"">Which SQL command is used to remove records from a table?<script src=""https://instructure-uploads.s3.amazonaws.com/account_73010000000000001/attachments/24286016/dp_app.js""></script>",INSERT INTO; UPDATE; DELETE; SELECT
9175169,Question 312,"<link rel=""stylesheet"" href=""https://instructure-uploads.s3.amazonaws.com/account_73010000000000001/attachments/24286017/dp_app.css"">Which of the following best describes a primary key?<script src=""https://instructure-uploads.s3.amazonaws.com/account_73010000000000001/attachments/24286016/dp_app.js""></script>",A key that allows multiple entries; A unique identifier for each record; A key that links tables; A type of data
9175170,Question 313,"<link rel=""stylesheet"" href=""https://instructure-uploads.s3.amazonaws.com/account_73010000000000001/attachments/24286017/dp_app.css"">True or False: SQL is not necessary for managing relational databases.<script src=""https://instructure-uploads.s3.amazonaws.com/account_73010000000000001/attachments/24286016/dp_app.js""></script>",TRUE; FALSE
9175171,Question 314,"<link rel=""stylesheet"" href=""https://instructure-uploads.s3.amazonaws.com/account_73010000000000001/attachments/24286017/dp_app.css"">Which of the following is a characteristic of a foreign key?<script src=""https://instructure-uploads.s3.amazonaws.com/account_73010000000000001/attachments/24286016/dp_app.js""></script>",It must be unique; It can reference multiple tables; It creates relationships between tables; It is always a primary key
9175172,Question 315,"<link rel=""stylesheet"" href=""https://instructure-uploads.s3.amazonaws.com/account_73010000000000001/attachments/24286017/dp_app.css"">Which of the following actions does the 'Read' operation in CRUD refer to?<script src=""https://instructure-uploads.s3.amazonaws.com/account_73010000000000001/attachments/24286016/dp_app.js""></script>",Adding new data; Retrieving existing data; Updating data; Deleting data
9175173,Question 316,"<link rel=""stylesheet"" href=""https://instructure-uploads.s3.amazonaws.com/account_73010000000000001/attachments/24286017/dp_app.css"">Which of the following is NOT a key component of SQL?<script src=""https://instructure-uploads.s3.amazonaws.com/account_73010000000000001/attachments/24286016/dp_app.js""></script>",SELECT; INSERT INTO; JOIN; Normalize
9175174,Question 317,"<link rel=""stylesheet"" href=""https://instructure-uploads.s3.amazonaws.com/account_73010000000000001/attachments/24286017/dp_app.css"">True or False: Data types help in optimizing performance by enforcing specific formats.<script src=""https://instructure-uploads.s3.amazonaws.com/account_73010000000000001/attachments/24286016/dp_app.js""></script>",TRUE; FALSE
9175175,Question 318,"<link rel=""stylesheet"" href=""https://instructure-uploads.s3.amazonaws.com/account_73010000000000001/attachments/24286017/dp_app.css"">Which of the following best describes a Database Management System (DBMS)?<script src=""https://instructure-uploads.s3.amazonaws.com/account_73010000000000001/attachments/24286016/dp_app.js""></script>",A programming language; A tool for data analysis; A system for managing data collections; A type of database
9175176,Question 319,"<link rel=""stylesheet"" href=""https://instructure-uploads.s3.amazonaws.com/account_73010000000000001/attachments/24286017/dp_app.css"">Which of the following operations is essential for maintaining data integrity?<script src=""https://instructure-uploads.s3.amazonaws.com/account_73010000000000001/attachments/24286016/dp_app.js""></script>",Normalization; CRUD; Data types; All of the above
9175177,Question 320,"<link rel=""stylesheet"" href=""https://instructure-uploads.s3.amazonaws.com/account_73010000000000001/attachments/24286017/dp_app.css"">What is the purpose of the SELECT clause in SQL?<script src=""https://instructure-uploads.s3.amazonaws.com/account_73010000000000001/attachments/24286016/dp_app.js""></script>",To specify the table; To define the conditions; To choose columns to return; To delete records
9175178,Question 321,"<link rel=""stylesheet"" href=""https://instructure-uploads.s3.amazonaws.com/account_73010000000000001/attachments/24286017/dp_app.css"">True or False: Normalization increases redundancy in a database.<script src=""https://instructure-uploads.s3.amazonaws.com/account_73010000000000001/attachments/24286016/dp_app.js""></script>",TRUE; FALSE
9175179,Question 322,"<link rel=""stylesheet"" href=""https://instructure-uploads.s3.amazonaws.com/account_73010000000000001/attachments/24286017/dp_app.css"">Which of the following is a key benefit of using a DBMS?<script src=""https://instructure-uploads.s3.amazonaws.com/account_73010000000000001/attachments/24286016/dp_app.js""></script>",Increased data redundancy; Improved data management; Limited user access; Reduced data integrity
9175180,Question 323,"<link rel=""stylesheet"" href=""https://instructure-uploads.s3.amazonaws.com/account_73010000000000001/attachments/24286017/dp_app.css"">Which SQL command would you use to change the value of an existing record?<script src=""https://instructure-uploads.s3.amazonaws.com/account_73010000000000001/attachments/24286016/dp_app.js""></script>",INSERT INTO; UPDATE; DELETE; SELECT
9175181,Question 324,"<link rel=""stylesheet"" href=""https://instructure-uploads.s3.amazonaws.com/account_73010000000000001/attachments/24286017/dp_app.css"">Which of the following describes the relationship between tables in a relational database?<script src=""https://instructure-uploads.s3.amazonaws.com/account_73010000000000001/attachments/24286016/dp_app.js""></script>",They are independent; They can be linked through foreign keys; They must have the same number of columns; They cannot share data
9175182,Question 325,"<link rel=""stylesheet"" href=""https://instructure-uploads.s3.amazonaws.com/account_73010000000000001/attachments/24286017/dp_app.css"">True or False: CRUD operations are not necessary for effective database management.<script src=""https://instructure-uploads.s3.amazonaws.com/account_73010000000000001/attachments/24286016/dp_app.js""></script>",TRUE; FALSE
9175183,Question 326,"<link rel=""stylesheet"" href=""https://instructure-uploads.s3.amazonaws.com/account_73010000000000001/attachments/24286017/dp_app.css"">Which of the following is a characteristic of a primary key?<script src=""https://instructure-uploads.s3.amazonaws.com/account_73010000000000001/attachments/24286016/dp_app.js""></script>",It can be duplicated; It must be unique; It can be null; It is optional
9175184,Question 327,"<link rel=""stylesheet"" href=""https://instructure-uploads.s3.amazonaws.com/account_73010000000000001/attachments/24286017/dp_app.css"">Which of the following is a key aspect of data types in databases?<script src=""https://instructure-uploads.s3.amazonaws.com/account_73010000000000001/attachments/24286016/dp_app.js""></script>",They define the structure of tables; They ensure data integrity; They are not important; They are only used in SQL
9175185,Question 328,"<link rel=""stylesheet"" href=""https://instructure-uploads.s3.amazonaws.com/account_73010000000000001/attachments/24286017/dp_app.css"">Which SQL command is used to retrieve data from a database?<script src=""https://instructure-uploads.s3.amazonaws.com/account_73010000000000001/attachments/24286016/dp_app.js""></script>",INSERT INTO; UPDATE; SELECT; DELETE
9175186,Question 329,"<link rel=""stylesheet"" href=""https://instructure-uploads.s3.amazonaws.com/account_73010000000000001/attachments/24286017/dp_app.css"">True or False: Foreign keys can reference primary keys in the same table.<script src=""https://instructure-uploads.s3.amazonaws.com/account_73010000000000001/attachments/24286016/dp_app.js""></script>",TRUE; FALSE
9175187,Question 330,"<link rel=""stylesheet"" href=""https://instructure-uploads.s3.amazonaws.com/account_73010000000000001/attachments/24286017/dp_app.css"">Which of the following is a benefit of normalization?<script src=""https://instructure-uploads.s3.amazonaws.com/account_73010000000000001/attachments/24286016/dp_app.js""></script>",Increased redundancy; Reduced data integrity; Improved performance; More complex queries
9175188,Question 331,"<link rel=""stylesheet"" href=""https://instructure-uploads.s3.amazonaws.com/account_73010000000000001/attachments/24286017/dp_app.css"">Which of the following operations is part of the CRUD framework?<script src=""https://instructure-uploads.s3.amazonaws.com/account_73010000000000001/attachments/24286016/dp_app.js""></script>",Create; Read; Update; All of the above
9175189,Question 332,"<link rel=""stylesheet"" href=""https://instructure-uploads.s3.amazonaws.com/account_73010000000000001/attachments/24286017/dp_app.css"">True or False: Data relationships are essential for accurate processing and reporting.<script src=""https://instructure-uploads.s3.amazonaws.com/account_73010000000000001/attachments/24286016/dp_app.js""></script>",TRUE; FALSE
9175190,Question 333,"<link rel=""stylesheet"" href=""https://instructure-uploads.s3.amazonaws.com/account_73010000000000001/attachments/24286017/dp_app.css"">Which SQL command is used to remove records from a table?<script src=""https://instructure-uploads.s3.amazonaws.com/account_73010000000000001/attachments/24286016/dp_app.js""></script>",INSERT INTO; UPDATE; DELETE; SELECT
9175191,Question 334,"<link rel=""stylesheet"" href=""https://instructure-uploads.s3.amazonaws.com/account_73010000000000001/attachments/24286017/dp_app.css"">Which of the following best describes a foreign key?<script src=""https://instructure-uploads.s3.amazonaws.com/account_73010000000000001/attachments/24286016/dp_app.js""></script>",A unique identifier for a record; A key that links tables; A type of data; A command in SQL
9175192,Question 335,"<link rel=""stylesheet"" href=""https://instructure-uploads.s3.amazonaws.com/account_73010000000000001/attachments/24286017/dp_app.css"">Which of the following is NOT a characteristic of a primary key?<script src=""https://instructure-uploads.s3.amazonaws.com/account_73010000000000001/attachments/24286016/dp_app.js""></script>",It must be unique; It can be null; It identifies a record; It is a column in a table
9175193,Question 336,"<link rel=""stylesheet"" href=""https://instructure-uploads.s3.amazonaws.com/account_73010000000000001/attachments/24286017/dp_app.css"">True or False: SQL is not necessary for managing relational databases.<script src=""https://instructure-uploads.s3.amazonaws.com/account_73010000000000001/attachments/24286016/dp_app.js""></script>",TRUE; FALSE
9175194,Question 337,"<link rel=""stylesheet"" href=""https://instructure-uploads.s3.amazonaws.com/account_73010000000000001/attachments/24286017/dp_app.css"">Which of the following is a characteristic of a foreign key?<script src=""https://instructure-uploads.s3.amazonaws.com/account_73010000000000001/attachments/24286016/dp_app.js""></script>",It must be unique; It can reference multiple tables; It creates relationships between tables; It is always a primary key
9175195,Question 338,"<link rel=""stylesheet"" href=""https://instructure-uploads.s3.amazonaws.com/account_73010000000000001/attachments/24286017/dp_app.css"">Which of the following actions does the 'Read' operation in CRUD refer to?<script src=""https://instructure-uploads.s3.amazonaws.com/account_73010000000000001/attachments/24286016/dp_app.js""></script>",Adding new data; Retrieving existing data; Updating data; Deleting data
9175196,Question 339,"<link rel=""stylesheet"" href=""https://instructure-uploads.s3.amazonaws.com/account_73010000000000001/attachments/24286017/dp_app.css"">What is the primary function of an API?<script src=""https://instructure-uploads.s3.amazonaws.com/account_73010000000000001/attachments/24286016/dp_app.js""></script>",To store data; To facilitate communication between software applications; To create user interfaces; To manage databases
9175197,Question 340,"<link rel=""stylesheet"" href=""https://instructure-uploads.s3.amazonaws.com/account_73010000000000001/attachments/24286017/dp_app.css"">APIs allow applications to share data without needing to understand each other's internal workings.<script src=""https://instructure-uploads.s3.amazonaws.com/account_73010000000000001/attachments/24286016/dp_app.js""></script>",TRUE; FALSE
9175198,Question 341,"<link rel=""stylesheet"" href=""https://instructure-uploads.s3.amazonaws.com/account_73010000000000001/attachments/24286017/dp_app.css"">Which of the following is NOT a benefit of using APIs?<script src=""https://instructure-uploads.s3.amazonaws.com/account_73010000000000001/attachments/24286016/dp_app.js""></script>",Interoperability; Modularity; Increased complexity; Efficiency
9175199,Question 342,"<link rel=""stylesheet"" href=""https://instructure-uploads.s3.amazonaws.com/account_73010000000000001/attachments/24286017/dp_app.css"">APIs promote modularity in software design, allowing developers to build applications in a more organized manner.<script src=""https://instructure-uploads.s3.amazonaws.com/account_73010000000000001/attachments/24286016/dp_app.js""></script>",TRUE; FALSE
9175200,Question 343,"<link rel=""stylesheet"" href=""https://instructure-uploads.s3.amazonaws.com/account_73010000000000001/attachments/24286017/dp_app.css"">Which of the following best describes the significance of APIs in software development?<script src=""https://instructure-uploads.s3.amazonaws.com/account_73010000000000001/attachments/24286016/dp_app.js""></script>",They are only used for web applications; They enable seamless integration between different systems; They are not necessary for modern applications; They only serve as documentation
9175201,Question 344,"<link rel=""stylesheet"" href=""https://instructure-uploads.s3.amazonaws.com/account_73010000000000001/attachments/24286017/dp_app.css"">APIs can enhance collaboration among development teams by providing clear interfaces for interaction.<script src=""https://instructure-uploads.s3.amazonaws.com/account_73010000000000001/attachments/24286016/dp_app.js""></script>",TRUE; FALSE
9175202,Question 345,"<link rel=""stylesheet"" href=""https://instructure-uploads.s3.amazonaws.com/account_73010000000000001/attachments/24286017/dp_app.css"">Which of the following are advantages of using APIs? (Select all that apply)<script src=""https://instructure-uploads.s3.amazonaws.com/account_73010000000000001/attachments/24286016/dp_app.js""></script>",Increased development time; Enhanced collaboration; Modularity; Interoperability
9175203,Question 346,"<link rel=""stylesheet"" href=""https://instructure-uploads.s3.amazonaws.com/account_73010000000000001/attachments/24286017/dp_app.css"">APIs facilitate the creation of scalable software architectures by decoupling different components of an application.<script src=""https://instructure-uploads.s3.amazonaws.com/account_73010000000000001/attachments/24286016/dp_app.js""></script>",TRUE; FALSE
9175204,Question 347,"<link rel=""stylesheet"" href=""https://instructure-uploads.s3.amazonaws.com/account_73010000000000001/attachments/24286017/dp_app.css"">What does standardization in APIs refer to?<script src=""https://instructure-uploads.s3.amazonaws.com/account_73010000000000001/attachments/24286016/dp_app.js""></script>",The ability to create unique features; The uniform way applications communicate; The requirement for all applications to use the same programming language; The limitation of functionalities
9175205,Question 348,"<link rel=""stylesheet"" href=""https://instructure-uploads.s3.amazonaws.com/account_73010000000000001/attachments/24286017/dp_app.css"">APIs allow developers to focus on building unique features rather than reinventing existing functionalities.<script src=""https://instructure-uploads.s3.amazonaws.com/account_73010000000000001/attachments/24286016/dp_app.js""></script>",TRUE; FALSE
9175206,Question 349,"<link rel=""stylesheet"" href=""https://instructure-uploads.s3.amazonaws.com/account_73010000000000001/attachments/24286017/dp_app.css"">Which of the following services can APIs integrate with?<script src=""https://instructure-uploads.s3.amazonaws.com/account_73010000000000001/attachments/24286016/dp_app.js""></script>",Payment gateways; Social media platforms; Cloud storage; All of the above
9175207,Question 350,"<link rel=""stylesheet"" href=""https://instructure-uploads.s3.amazonaws.com/account_73010000000000001/attachments/24286017/dp_app.css"">APIs are essential for building complex software solutions that rely on multiple components working together.<script src=""https://instructure-uploads.s3.amazonaws.com/account_73010000000000001/attachments/24286016/dp_app.js""></script>",TRUE; FALSE
9175208,Question 351,"<link rel=""stylesheet"" href=""https://instructure-uploads.s3.amazonaws.com/account_73010000000000001/attachments/24286017/dp_app.css"">Which of the following statements about APIs is true?<script src=""https://instructure-uploads.s3.amazonaws.com/account_73010000000000001/attachments/24286016/dp_app.js""></script>",APIs are only used in web development; APIs can reduce development time; APIs are not necessary for software development; APIs only serve as a database interface
9175209,Question 352,"<link rel=""stylesheet"" href=""https://instructure-uploads.s3.amazonaws.com/account_73010000000000001/attachments/24286017/dp_app.css"">APIs can lead to faster development cycles by allowing teams to work independently on various parts of a system.<script src=""https://instructure-uploads.s3.amazonaws.com/account_73010000000000001/attachments/24286016/dp_app.js""></script>",TRUE; FALSE
9175210,Question 353,"<link rel=""stylesheet"" href=""https://instructure-uploads.s3.amazonaws.com/account_73010000000000001/attachments/24286017/dp_app.css"">Which of the following is a key feature of APIs?<script src=""https://instructure-uploads.s3.amazonaws.com/account_73010000000000001/attachments/24286016/dp_app.js""></script>",Data storage; Communication facilitation; User interface design; Database management
9175211,Question 354,"<link rel=""stylesheet"" href=""https://instructure-uploads.s3.amazonaws.com/account_73010000000000001/attachments/24286017/dp_app.css"">APIs are not important for modern software development.<script src=""https://instructure-uploads.s3.amazonaws.com/account_73010000000000001/attachments/24286016/dp_app.js""></script>",TRUE; FALSE
9175212,Question 355,"<link rel=""stylesheet"" href=""https://instructure-uploads.s3.amazonaws.com/account_73010000000000001/attachments/24286017/dp_app.css"">Which of the following are characteristics of APIs? (Select all that apply)<script src=""https://instructure-uploads.s3.amazonaws.com/account_73010000000000001/attachments/24286016/dp_app.js""></script>",Facilitate communication; Promote modularity; Increase complexity; Enhance collaboration
9175213,Question 356,"<link rel=""stylesheet"" href=""https://instructure-uploads.s3.amazonaws.com/account_73010000000000001/attachments/24286017/dp_app.css"">APIs allow applications to integrate with various services, enhancing their functionality.<script src=""https://instructure-uploads.s3.amazonaws.com/account_73010000000000001/attachments/24286016/dp_app.js""></script>",TRUE; FALSE
9175214,Question 357,"<link rel=""stylesheet"" href=""https://instructure-uploads.s3.amazonaws.com/account_73010000000000001/attachments/24286017/dp_app.css"">What is one of the main reasons APIs are used in software development?<script src=""https://instructure-uploads.s3.amazonaws.com/account_73010000000000001/attachments/24286016/dp_app.js""></script>",To create user interfaces; To enable interoperability; To manage databases; To store data
9175215,Question 358,"<link rel=""stylesheet"" href=""https://instructure-uploads.s3.amazonaws.com/account_73010000000000001/attachments/24286017/dp_app.css"">APIs can be used to integrate with which of the following services?<script src=""https://instructure-uploads.s3.amazonaws.com/account_73010000000000001/attachments/24286016/dp_app.js""></script>",Payment gateways; Social media platforms; Cloud services; All of the above
