id,title,question_text,choices
9174651,Question 225,"<link rel=""stylesheet"" href=""https://instructure-uploads.s3.amazonaws.com/account_73010000000000001/attachments/24286017/dp_app.css"">True or False: In web development, version control systems help manage changes to websites and applications.<script src=""https://instructure-uploads.s3.amazonaws.com/account_73010000000000001/attachments/24286016/dp_app.js""></script>",TRUE; FALSE; questions_210125020325.csv
9174652,Question 226,"<link rel=""stylesheet"" href=""https://instructure-uploads.s3.amazonaws.com/account_73010000000000001/attachments/24286017/dp_app.css"">Which of the following statements about branches is true?<script src=""https://instructure-uploads.s3.amazonaws.com/account_73010000000000001/attachments/24286016/dp_app.js""></script>",Branches are used to delete files; Branches allow for parallel development; Branches are only for single-user projects; Branches cannot be merged; questions_210125020325.csv
9174653,Question 227,"<link rel=""stylesheet"" href=""https://instructure-uploads.s3.amazonaws.com/account_73010000000000001/attachments/24286017/dp_app.css"">What is the role of version control in content creation?<script src=""https://instructure-uploads.s3.amazonaws.com/account_73010000000000001/attachments/24286016/dp_app.js""></script>",To create new content; To track changes over time; To publish content; To format documents; questions_210125020325.csv
9174654,Question 228,"<link rel=""stylesheet"" href=""https://instructure-uploads.s3.amazonaws.com/account_73010000000000001/attachments/24286017/dp_app.css"">Which of the following is a common use of version control in document management?<script src=""https://instructure-uploads.s3.amazonaws.com/account_73010000000000001/attachments/24286016/dp_app.js""></script>",To permanently delete old versions; To maintain a history of changes; To restrict access to files; To create new documents; questions_210125020325.csv
9174655,Question 229,"<link rel=""stylesheet"" href=""https://instructure-uploads.s3.amazonaws.com/account_73010000000000001/attachments/24286017/dp_app.css"">True or False: The push command is used to download changes from a remote repository.<script src=""https://instructure-uploads.s3.amazonaws.com/account_73010000000000001/attachments/24286016/dp_app.js""></script>",TRUE; FALSE; questions_210125020325.csv
9174656,Question 230,"<link rel=""stylesheet"" href=""https://instructure-uploads.s3.amazonaws.com/account_73010000000000001/attachments/24286017/dp_app.css"">What is the main advantage of using version control in software development?<script src=""https://instructure-uploads.s3.amazonaws.com/account_73010000000000001/attachments/24286016/dp_app.js""></script>",It allows for unlimited storage; It prevents all errors; It facilitates collaboration and tracks changes; It eliminates the need for backups; questions_210125020325.csv
9174657,Question 231,"<link rel=""stylesheet"" href=""https://instructure-uploads.s3.amazonaws.com/account_73010000000000001/attachments/24286017/dp_app.css"">Which of the following best describes the concept of merging in version control?<script src=""https://instructure-uploads.s3.amazonaws.com/account_73010000000000001/attachments/24286016/dp_app.js""></script>",Creating a new branch; Combining changes from different branches; Deleting a branch; Reverting to a previous version; questions_210125020325.csv
9174658,Question 232,"<link rel=""stylesheet"" href=""https://instructure-uploads.s3.amazonaws.com/account_73010000000000001/attachments/24286017/dp_app.css"">True or False: Version control systems can be used in data analysis.<script src=""https://instructure-uploads.s3.amazonaws.com/account_73010000000000001/attachments/24286016/dp_app.js""></script>",TRUE; FALSE; questions_210125020325.csv
9174659,Question 233,"<link rel=""stylesheet"" href=""https://instructure-uploads.s3.amazonaws.com/account_73010000000000001/attachments/24286017/dp_app.css"">Which of the following is NOT a benefit of using version control?<script src=""https://instructure-uploads.s3.amazonaws.com/account_73010000000000001/attachments/24286016/dp_app.js""></script>",Tracking changes; Facilitating collaboration; Preventing all errors; Maintaining project history; questions_210125020325.csv
9174660,Question 234,"<link rel=""stylesheet"" href=""https://instructure-uploads.s3.amazonaws.com/account_73010000000000001/attachments/24286017/dp_app.css"">What does the term 'commit' refer to in version control?<script src=""https://instructure-uploads.s3.amazonaws.com/account_73010000000000001/attachments/24286016/dp_app.js""></script>",A snapshot of changes; A new branch; A deleted file; A backup of the repository; questions_210125020325.csv
9174661,Question 235,"<link rel=""stylesheet"" href=""https://instructure-uploads.s3.amazonaws.com/account_73010000000000001/attachments/24286017/dp_app.css"">Which of the following is a key function of repositories in version control?<script src=""https://instructure-uploads.s3.amazonaws.com/account_73010000000000001/attachments/24286016/dp_app.js""></script>",To store project files and their history; To delete old versions; To create backups; To restrict access; questions_210125020325.csv
9174662,Question 236,"<link rel=""stylesheet"" href=""https://instructure-uploads.s3.amazonaws.com/account_73010000000000001/attachments/24286017/dp_app.css"">True or False: The staging area is where changes are organized before being committed.<script src=""https://instructure-uploads.s3.amazonaws.com/account_73010000000000001/attachments/24286016/dp_app.js""></script>",TRUE; FALSE; questions_210125020325.csv
9174663,Question 237,"<link rel=""stylesheet"" href=""https://instructure-uploads.s3.amazonaws.com/account_73010000000000001/attachments/24286017/dp_app.css"">Which of the following statements about version control is true?<script src=""https://instructure-uploads.s3.amazonaws.com/account_73010000000000001/attachments/24286016/dp_app.js""></script>",It is only used in software development; It is essential for managing changes in collaborative projects; It prevents all errors; It is not necessary for small projects; questions_210125020325.csv
9174664,Question 238,"<link rel=""stylesheet"" href=""https://instructure-uploads.s3.amazonaws.com/account_73010000000000001/attachments/24286017/dp_app.css"">What is the primary function of the push command in version control?<script src=""https://instructure-uploads.s3.amazonaws.com/account_73010000000000001/attachments/24286016/dp_app.js""></script>",To upload local changes to a remote repository; To download changes from a remote repository; To create a new branch; To delete a branch; questions_210125020325.csv
9174665,Question 239,"<link rel=""stylesheet"" href=""https://instructure-uploads.s3.amazonaws.com/account_73010000000000001/attachments/24286017/dp_app.css"">Which of the following is a common application of version control in web development?<script src=""https://instructure-uploads.s3.amazonaws.com/account_73010000000000001/attachments/24286016/dp_app.js""></script>",Managing changes to websites; Creating new websites; Deleting old websites; Restricting access to websites; questions_210125020325.csv
9174666,Question 240,"<link rel=""stylesheet"" href=""https://instructure-uploads.s3.amazonaws.com/account_73010000000000001/attachments/24286017/dp_app.css"">True or False: Version control systems are only useful for software projects.<script src=""https://instructure-uploads.s3.amazonaws.com/account_73010000000000001/attachments/24286016/dp_app.js""></script>",TRUE; FALSE; questions_210125020325.csv
9174667,Question 241,"<link rel=""stylesheet"" href=""https://instructure-uploads.s3.amazonaws.com/account_73010000000000001/attachments/24286017/dp_app.css"">Which of the following best describes the role of branches in version control?<script src=""https://instructure-uploads.s3.amazonaws.com/account_73010000000000001/attachments/24286016/dp_app.js""></script>",To delete files; To allow parallel development; To create backups; To restrict access; questions_210125020325.csv
9174668,Question 242,"<link rel=""stylesheet"" href=""https://instructure-uploads.s3.amazonaws.com/account_73010000000000001/attachments/24286017/dp_app.css"">What is the significance of commits in version control?<script src=""https://instructure-uploads.s3.amazonaws.com/account_73010000000000001/attachments/24286016/dp_app.js""></script>",They represent points in the project's history; They delete old versions; They create new branches; They restrict access to files; questions_210125020325.csv
9174669,Question 243,"<link rel=""stylesheet"" href=""https://instructure-uploads.s3.amazonaws.com/account_73010000000000001/attachments/24286017/dp_app.css"">Which of the following is NOT a feature of version control systems?<script src=""https://instructure-uploads.s3.amazonaws.com/account_73010000000000001/attachments/24286016/dp_app.js""></script>",Change tracking; Real-time collaboration; File encryption; Branching; questions_210125020325.csv
9174670,Question 244,"<link rel=""stylesheet"" href=""https://instructure-uploads.s3.amazonaws.com/account_73010000000000001/attachments/24286017/dp_app.css"">True or False: Merging is essential for integrating changes from different branches.<script src=""https://instructure-uploads.s3.amazonaws.com/account_73010000000000001/attachments/24286016/dp_app.js""></script>",TRUE; FALSE; questions_210125020325.csv
9174671,Question 245,"<link rel=""stylesheet"" href=""https://instructure-uploads.s3.amazonaws.com/account_73010000000000001/attachments/24286017/dp_app.css"">What is the primary benefit of using version control in collaborative writing?<script src=""https://instructure-uploads.s3.amazonaws.com/account_73010000000000001/attachments/24286016/dp_app.js""></script>",It allows for real-time editing; It tracks changes and maintains a history; It prevents file sharing; It automatically formats documents; questions_210125020325.csv
9174672,Question 246,"<link rel=""stylesheet"" href=""https://instructure-uploads.s3.amazonaws.com/account_73010000000000001/attachments/24286017/dp_app.css"">Which of the following is a key concept in version control?<script src=""https://instructure-uploads.s3.amazonaws.com/account_73010000000000001/attachments/24286016/dp_app.js""></script>",Files; Repositories; Users; Permissions; questions_210125020325.csv
9174673,Question 247,"<link rel=""stylesheet"" href=""https://instructure-uploads.s3.amazonaws.com/account_73010000000000001/attachments/24286017/dp_app.css"">True or False: Version control is only applicable in software development.<script src=""https://instructure-uploads.s3.amazonaws.com/account_73010000000000001/attachments/24286016/dp_app.js""></script>",TRUE; FALSE; questions_210125020325.csv
9174674,Question 248,"<link rel=""stylesheet"" href=""https://instructure-uploads.s3.amazonaws.com/account_73010000000000001/attachments/24286017/dp_app.css"">Which of the following statements about version control is true?<script src=""https://instructure-uploads.s3.amazonaws.com/account_73010000000000001/attachments/24286016/dp_app.js""></script>",It is only used in software development; It is essential for managing changes in collaborative projects; It prevents all errors; It is not necessary for small projects; questions_210125020325.csv
9174675,Question 249,"<link rel=""stylesheet"" href=""https://instructure-uploads.s3.amazonaws.com/account_73010000000000001/attachments/24286017/dp_app.css"">What is the primary function of the push command in version control?<script src=""https://instructure-uploads.s3.amazonaws.com/account_73010000000000001/attachments/24286016/dp_app.js""></script>",To upload local changes to a remote repository; To download changes from a remote repository; To create a new branch; To delete a branch; questions_210125020325.csv
9174676,Question 250,"<link rel=""stylesheet"" href=""https://instructure-uploads.s3.amazonaws.com/account_73010000000000001/attachments/24286017/dp_app.css"">Which of the following is a common application of version control in web development?<script src=""https://instructure-uploads.s3.amazonaws.com/account_73010000000000001/attachments/24286016/dp_app.js""></script>",Managing changes to websites; Creating new websites; Deleting old websites; Restricting access to websites; questions_210125020325.csv
9174677,Question 251,"<link rel=""stylesheet"" href=""https://instructure-uploads.s3.amazonaws.com/account_73010000000000001/attachments/24286017/dp_app.css"">True or False: Version control systems are only useful for software projects.<script src=""https://instructure-uploads.s3.amazonaws.com/account_73010000000000001/attachments/24286016/dp_app.js""></script>",TRUE; FALSE; questions_210125020325.csv
9174678,Question 252,"<link rel=""stylesheet"" href=""https://instructure-uploads.s3.amazonaws.com/account_73010000000000001/attachments/24286017/dp_app.css"">Which of the following best describes the role of branches in version control?<script src=""https://instructure-uploads.s3.amazonaws.com/account_73010000000000001/attachments/24286016/dp_app.js""></script>",To delete files; To allow parallel development; To create backups; To restrict access; questions_210125020325.csv
9174679,Question 253,"<link rel=""stylesheet"" href=""https://instructure-uploads.s3.amazonaws.com/account_73010000000000001/attachments/24286017/dp_app.css"">What is the significance of commits in version control?<script src=""https://instructure-uploads.s3.amazonaws.com/account_73010000000000001/attachments/24286016/dp_app.js""></script>",They represent points in the project's history; They delete old versions; They create new branches; They restrict access to files; questions_210125020325.csv
9174680,Question 254,"<link rel=""stylesheet"" href=""https://instructure-uploads.s3.amazonaws.com/account_73010000000000001/attachments/24286017/dp_app.css"">Which of the following is NOT a feature of version control systems?<script src=""https://instructure-uploads.s3.amazonaws.com/account_73010000000000001/attachments/24286016/dp_app.js""></script>",Change tracking; Real-time collaboration; File encryption; Branching; questions_210125020325.csv
9174681,Question 255,"<link rel=""stylesheet"" href=""https://instructure-uploads.s3.amazonaws.com/account_73010000000000001/attachments/24286017/dp_app.css"">True or False: Merging is essential for integrating changes from different branches.<script src=""https://instructure-uploads.s3.amazonaws.com/account_73010000000000001/attachments/24286016/dp_app.js""></script>",TRUE; FALSE; questions_210125020325.csv
9174682,Question 256,"<link rel=""stylesheet"" href=""https://instructure-uploads.s3.amazonaws.com/account_73010000000000001/attachments/24286017/dp_app.css"">What is the primary benefit of using version control in collaborative writing?<script src=""https://instructure-uploads.s3.amazonaws.com/account_73010000000000001/attachments/24286016/dp_app.js""></script>",It allows for real-time editing; It tracks changes and maintains a history; It prevents file sharing; It automatically formats documents; questions_210125020325.csv
9174683,Question 257,"<link rel=""stylesheet"" href=""https://instructure-uploads.s3.amazonaws.com/account_73010000000000001/attachments/24286017/dp_app.css"">What are the stages included in the Software Development Life Cycle (SDLC)?<script src=""https://instructure-uploads.s3.amazonaws.com/account_73010000000000001/attachments/24286016/dp_app.js""></script>",Requirements gathering; Design; Implementation; All of the above; questions_210402020325.csv
9174684,Question 258,"<link rel=""stylesheet"" href=""https://instructure-uploads.s3.amazonaws.com/account_73010000000000001/attachments/24286017/dp_app.css"">The SDLC helps to mitigate risks and improve project outcomes.<script src=""https://instructure-uploads.s3.amazonaws.com/account_73010000000000001/attachments/24286016/dp_app.js""></script>",TRUE; FALSE; questions_210402020325.csv
9174685,Question 259,"<link rel=""stylesheet"" href=""https://instructure-uploads.s3.amazonaws.com/account_73010000000000001/attachments/24286017/dp_app.css"">Which of the following is NOT a phase of the SDLC?<script src=""https://instructure-uploads.s3.amazonaws.com/account_73010000000000001/attachments/24286016/dp_app.js""></script>",Verification; Maintenance; Deployment; Documentation; questions_210402020325.csv
9174686,Question 260,"<link rel=""stylesheet"" href=""https://instructure-uploads.s3.amazonaws.com/account_73010000000000001/attachments/24286017/dp_app.css"">What is the primary goal of software implementation?<script src=""https://instructure-uploads.s3.amazonaws.com/account_73010000000000001/attachments/24286016/dp_app.js""></script>",To create documentation; To integrate software into existing systems; To conduct user training; To perform market analysis; questions_210402020325.csv
9174687,Question 261,"<link rel=""stylesheet"" href=""https://instructure-uploads.s3.amazonaws.com/account_73010000000000001/attachments/24286017/dp_app.css"">Which of the following activities is part of the deployment process?<script src=""https://instructure-uploads.s3.amazonaws.com/account_73010000000000001/attachments/24286016/dp_app.js""></script>",Installation; Configuration; Testing; All of the above; questions_210402020325.csv
9174688,Question 262,"<link rel=""stylesheet"" href=""https://instructure-uploads.s3.amazonaws.com/account_73010000000000001/attachments/24286017/dp_app.css"">Effective implementation requires collaboration among which teams?<script src=""https://instructure-uploads.s3.amazonaws.com/account_73010000000000001/attachments/24286016/dp_app.js""></script>",Development; Testing; Operations; All of the above; questions_210402020325.csv
9174689,Question 263,"<link rel=""stylesheet"" href=""https://instructure-uploads.s3.amazonaws.com/account_73010000000000001/attachments/24286017/dp_app.css"">What does CI/CD stand for?<script src=""https://instructure-uploads.s3.amazonaws.com/account_73010000000000001/attachments/24286016/dp_app.js""></script>",Continuous Integration and Continuous Development; Continuous Integration and Continuous Deployment; Continuous Improvement and Continuous Deployment; Continuous Integration and Continuous Delivery; questions_210402020325.csv
9174690,Question 264,"<link rel=""stylesheet"" href=""https://instructure-uploads.s3.amazonaws.com/account_73010000000000001/attachments/24286017/dp_app.css"">Telemetry in CI/CD provides insights into what?<script src=""https://instructure-uploads.s3.amazonaws.com/account_73010000000000001/attachments/24286016/dp_app.js""></script>",User satisfaction; Performance and security; Market trends; Development costs; questions_210402020325.csv
9174691,Question 265,"<link rel=""stylesheet"" href=""https://instructure-uploads.s3.amazonaws.com/account_73010000000000001/attachments/24286017/dp_app.css"">Software testing is crucial for ensuring software quality.<script src=""https://instructure-uploads.s3.amazonaws.com/account_73010000000000001/attachments/24286016/dp_app.js""></script>",TRUE; FALSE; questions_210402020325.csv
9174692,Question 266,"<link rel=""stylesheet"" href=""https://instructure-uploads.s3.amazonaws.com/account_73010000000000001/attachments/24286017/dp_app.css"">Which of the following is a challenge in deployment?<script src=""https://instructure-uploads.s3.amazonaws.com/account_73010000000000001/attachments/24286016/dp_app.js""></script>",Configuration errors; User training; Documentation; All of the above; questions_210402020325.csv
9174693,Question 267,"<link rel=""stylesheet"" href=""https://instructure-uploads.s3.amazonaws.com/account_73010000000000001/attachments/24286017/dp_app.css"">What is the purpose of documentation in software deployment?<script src=""https://instructure-uploads.s3.amazonaws.com/account_73010000000000001/attachments/24286016/dp_app.js""></script>",To provide installation procedures; To enhance user training; To ensure software quality; All of the above; questions_210402020325.csv
9174694,Question 268,"<link rel=""stylesheet"" href=""https://instructure-uploads.s3.amazonaws.com/account_73010000000000001/attachments/24286017/dp_app.css"">Which of the following is a key aspect of user training?<script src=""https://instructure-uploads.s3.amazonaws.com/account_73010000000000001/attachments/24286016/dp_app.js""></script>",Familiarizing users with software features; Conducting market research; Creating software documentation; Performing system maintenance; questions_210402020325.csv
9174695,Question 269,"<link rel=""stylesheet"" href=""https://instructure-uploads.s3.amazonaws.com/account_73010000000000001/attachments/24286017/dp_app.css"">Which of the following is NOT a part of the implementation phase?<script src=""https://instructure-uploads.s3.amazonaws.com/account_73010000000000001/attachments/24286016/dp_app.js""></script>",Planning; Installation; Testing; User feedback; questions_210402020325.csv
9174696,Question 270,"<link rel=""stylesheet"" href=""https://instructure-uploads.s3.amazonaws.com/account_73010000000000001/attachments/24286017/dp_app.css"">What is the main focus of the Software Testing Life Cycle (STLC)?<script src=""https://instructure-uploads.s3.amazonaws.com/account_73010000000000001/attachments/24286016/dp_app.js""></script>",Deployment; Testing methodologies; User training; Documentation; questions_210402020325.csv
9174697,Question 271,"<link rel=""stylesheet"" href=""https://instructure-uploads.s3.amazonaws.com/account_73010000000000001/attachments/24286017/dp_app.css"">Which of the following can lead to system failures during deployment?<script src=""https://instructure-uploads.s3.amazonaws.com/account_73010000000000001/attachments/24286016/dp_app.js""></script>",Configuration errors; Inadequate testing; Compatibility issues; All of the above; questions_210402020325.csv
9174698,Question 272,"<link rel=""stylesheet"" href=""https://instructure-uploads.s3.amazonaws.com/account_73010000000000001/attachments/24286017/dp_app.css"">Collaboration between which teams is essential during deployment?<script src=""https://instructure-uploads.s3.amazonaws.com/account_73010000000000001/attachments/24286016/dp_app.js""></script>",Development and operations; Marketing and sales; Testing and documentation; User support and development; questions_210402020325.csv
9174699,Question 273,"<link rel=""stylesheet"" href=""https://instructure-uploads.s3.amazonaws.com/account_73010000000000001/attachments/24286017/dp_app.css"">What is the impact of effective deployment strategies?<script src=""https://instructure-uploads.s3.amazonaws.com/account_73010000000000001/attachments/24286016/dp_app.js""></script>",Minimizing downtime; Increasing costs; Reducing user satisfaction; None of the above; questions_210402020325.csv
9174700,Question 274,"<link rel=""stylesheet"" href=""https://instructure-uploads.s3.amazonaws.com/account_73010000000000001/attachments/24286017/dp_app.css"">Which of the following is a benefit of CI/CD practices?<script src=""https://instructure-uploads.s3.amazonaws.com/account_73010000000000001/attachments/24286016/dp_app.js""></script>",Reduced risk of errors; Increased manual testing; Slower deployment; Higher costs; questions_210402020325.csv
9174701,Question 275,"<link rel=""stylesheet"" href=""https://instructure-uploads.s3.amazonaws.com/account_73010000000000001/attachments/24286017/dp_app.css"">Which of the following is a critical process in software development?<script src=""https://instructure-uploads.s3.amazonaws.com/account_73010000000000001/attachments/24286016/dp_app.js""></script>",Software testing; Market analysis; User feedback; Documentation; questions_210402020325.csv
9174702,Question 276,"<link rel=""stylesheet"" href=""https://instructure-uploads.s3.amazonaws.com/account_73010000000000001/attachments/24286017/dp_app.css"">What is the role of user training in software deployment?<script src=""https://instructure-uploads.s3.amazonaws.com/account_73010000000000001/attachments/24286016/dp_app.js""></script>",To enhance user adoption; To reduce costs; To create documentation; To perform testing; questions_210402020325.csv
9174703,Question 277,"<link rel=""stylesheet"" href=""https://instructure-uploads.s3.amazonaws.com/account_73010000000000001/attachments/24286017/dp_app.css"">Which of the following is a key component of effective software implementation?<script src=""https://instructure-uploads.s3.amazonaws.com/account_73010000000000001/attachments/24286016/dp_app.js""></script>",User feedback; Collaboration among teams; Market research; Documentation; questions_210402020325.csv
9174704,Question 278,"<link rel=""stylesheet"" href=""https://instructure-uploads.s3.amazonaws.com/account_73010000000000001/attachments/24286017/dp_app.css"">What is the main goal of software deployment?<script src=""https://instructure-uploads.s3.amazonaws.com/account_73010000000000001/attachments/24286016/dp_app.js""></script>",To make software available for use; To conduct user training; To gather user feedback; To perform market analysis; questions_210402020325.csv
9174705,Question 279,"<link rel=""stylesheet"" href=""https://instructure-uploads.s3.amazonaws.com/account_73010000000000001/attachments/24286017/dp_app.css"">Which of the following is a method to ensure software quality?<script src=""https://instructure-uploads.s3.amazonaws.com/account_73010000000000001/attachments/24286016/dp_app.js""></script>",Software testing; User training; Documentation; All of the above; questions_210402020325.csv
