id,title,question_text,choices
9174706,Question 280,"<link rel=""stylesheet"" href=""https://instructure-uploads.s3.amazonaws.com/account_73010000000000001/attachments/24286017/dp_app.css"">What is the significance of understanding deployment challenges?<script src=""https://instructure-uploads.s3.amazonaws.com/account_73010000000000001/attachments/24286016/dp_app.js""></script>",To mitigate risks; To increase costs; To reduce user satisfaction; None of the above; questions_210402020325.csv
9174707,Question 281,"<link rel=""stylesheet"" href=""https://instructure-uploads.s3.amazonaws.com/account_73010000000000001/attachments/24286017/dp_app.css"">Which of the following is a part of the software implementation process?<script src=""https://instructure-uploads.s3.amazonaws.com/account_73010000000000001/attachments/24286016/dp_app.js""></script>",Configuration; User training; Market analysis; Documentation; questions_210402020325.csv
9174708,Question 282,"<link rel=""stylesheet"" href=""https://instructure-uploads.s3.amazonaws.com/account_73010000000000001/attachments/24286017/dp_app.css"">What does effective documentation provide during deployment?<script src=""https://instructure-uploads.s3.amazonaws.com/account_73010000000000001/attachments/24286016/dp_app.js""></script>",Installation procedures; User feedback; Market trends; Development costs; questions_210402020325.csv
9174709,Question 283,"<link rel=""stylesheet"" href=""https://instructure-uploads.s3.amazonaws.com/account_73010000000000001/attachments/24286017/dp_app.css"">Which of the following is a benefit of user training?<script src=""https://instructure-uploads.s3.amazonaws.com/account_73010000000000001/attachments/24286016/dp_app.js""></script>",Enhanced user adoption; Increased costs; Reduced software quality; None of the above; questions_210402020325.csv
9174710,Question 284,"<link rel=""stylesheet"" href=""https://instructure-uploads.s3.amazonaws.com/account_73010000000000001/attachments/24286017/dp_app.css"">What is the primary focus of the implementation phase?<script src=""https://instructure-uploads.s3.amazonaws.com/account_73010000000000001/attachments/24286016/dp_app.js""></script>",Integrating software into existing systems; Conducting user training; Performing market analysis; Creating documentation; questions_210402020325.csv
9174711,Question 285,"<link rel=""stylesheet"" href=""https://instructure-uploads.s3.amazonaws.com/account_73010000000000001/attachments/24286017/dp_app.css"">Which of the following is a key aspect of CI/CD?<script src=""https://instructure-uploads.s3.amazonaws.com/account_73010000000000001/attachments/24286016/dp_app.js""></script>",Automating integration and deployment; Increasing manual processes; Reducing software quality; None of the above; questions_210402020325.csv
9174712,Question 286,"<link rel=""stylesheet"" href=""https://instructure-uploads.s3.amazonaws.com/account_73010000000000001/attachments/24286017/dp_app.css"">What is the role of telemetry in CI/CD?<script src=""https://instructure-uploads.s3.amazonaws.com/account_73010000000000001/attachments/24286016/dp_app.js""></script>",To provide insights into performance; To conduct user training; To create documentation; To perform market analysis; questions_210402020325.csv
9174713,Question 287,"<link rel=""stylesheet"" href=""https://instructure-uploads.s3.amazonaws.com/account_73010000000000001/attachments/24286017/dp_app.css"">Which of the following is a challenge in software deployment?<script src=""https://instructure-uploads.s3.amazonaws.com/account_73010000000000001/attachments/24286016/dp_app.js""></script>",Configuration errors; User training; Documentation; All of the above; questions_210402020325.csv
9174714,Question 288,"<link rel=""stylesheet"" href=""https://instructure-uploads.s3.amazonaws.com/account_73010000000000001/attachments/24286017/dp_app.css"">What is the significance of collaboration between development and operations teams?<script src=""https://instructure-uploads.s3.amazonaws.com/account_73010000000000001/attachments/24286016/dp_app.js""></script>",To address potential issues during deployment; To increase costs; To reduce user satisfaction; None of the above; questions_210402020325.csv
9174715,Question 289,"<link rel=""stylesheet"" href=""https://instructure-uploads.s3.amazonaws.com/account_73010000000000001/attachments/24286017/dp_app.css"">Which of the following is NOT a benefit of effective deployment strategies?<script src=""https://instructure-uploads.s3.amazonaws.com/account_73010000000000001/attachments/24286016/dp_app.js""></script>",Minimizing downtime; Ensuring user access; Increasing costs; Improving user satisfaction; questions_210402020325.csv
9174716,Question 290,"<link rel=""stylesheet"" href=""https://instructure-uploads.s3.amazonaws.com/account_73010000000000001/attachments/24286017/dp_app.css"">What is the main purpose of software testing?<script src=""https://instructure-uploads.s3.amazonaws.com/account_73010000000000001/attachments/24286016/dp_app.js""></script>",To evaluate and verify software quality; To conduct user training; To create documentation; To perform market analysis; questions_210402020325.csv
9174717,Question 291,"<link rel=""stylesheet"" href=""https://instructure-uploads.s3.amazonaws.com/account_73010000000000001/attachments/24286017/dp_app.css"">Which of the following is a critical aspect of the Software Testing Life Cycle (STLC)?<script src=""https://instructure-uploads.s3.amazonaws.com/account_73010000000000001/attachments/24286016/dp_app.js""></script>",Testing methodologies; User feedback; Market analysis; Documentation; questions_210402020325.csv
9174718,Question 292,"<link rel=""stylesheet"" href=""https://instructure-uploads.s3.amazonaws.com/account_73010000000000001/attachments/24286017/dp_app.css"">What is the impact of inadequate testing during deployment?<script src=""https://instructure-uploads.s3.amazonaws.com/account_73010000000000001/attachments/24286016/dp_app.js""></script>",System failures; Increased user satisfaction; Reduced costs; None of the above; questions_210402020325.csv
9174719,Question 293,"<link rel=""stylesheet"" href=""https://instructure-uploads.s3.amazonaws.com/account_73010000000000001/attachments/24286017/dp_app.css"">Which of the following is a key benefit of documentation?<script src=""https://instructure-uploads.s3.amazonaws.com/account_73010000000000001/attachments/24286016/dp_app.js""></script>",Providing installation procedures; Conducting user training; Performing market analysis; None of the above; questions_210402020325.csv
9174720,Question 294,"<link rel=""stylesheet"" href=""https://instructure-uploads.s3.amazonaws.com/account_73010000000000001/attachments/24286017/dp_app.css"">What is the main goal of user training?<script src=""https://instructure-uploads.s3.amazonaws.com/account_73010000000000001/attachments/24286016/dp_app.js""></script>",To enhance user adoption; To reduce costs; To create documentation; To perform testing; questions_210402020325.csv
9174721,Question 295,"<link rel=""stylesheet"" href=""https://instructure-uploads.s3.amazonaws.com/account_73010000000000001/attachments/24286017/dp_app.css"">Which of the following is a key component of effective software implementation?<script src=""https://instructure-uploads.s3.amazonaws.com/account_73010000000000001/attachments/24286016/dp_app.js""></script>",User feedback; Collaboration among teams; Market research; Documentation; questions_210402020325.csv
9174722,Question 296,"<link rel=""stylesheet"" href=""https://instructure-uploads.s3.amazonaws.com/account_73010000000000001/attachments/24286017/dp_app.css"">What is the main focus of the deployment phase?<script src=""https://instructure-uploads.s3.amazonaws.com/account_73010000000000001/attachments/24286016/dp_app.js""></script>",Making software available for use; Conducting user training; Gathering user feedback; Performing market analysis; questions_210402020325.csv
9174723,Question 297,"<link rel=""stylesheet"" href=""https://instructure-uploads.s3.amazonaws.com/account_73010000000000001/attachments/24286017/dp_app.css"">Which of the following is a method to ensure software quality?<script src=""https://instructure-uploads.s3.amazonaws.com/account_73010000000000001/attachments/24286016/dp_app.js""></script>",Software testing; User training; Documentation; All of the above; questions_210402020325.csv
9174724,Question 298,"<link rel=""stylesheet"" href=""https://instructure-uploads.s3.amazonaws.com/account_73010000000000001/attachments/24286017/dp_app.css"">What is the primary purpose of tables in relational databases?<script src=""https://instructure-uploads.s3.amazonaws.com/account_73010000000000001/attachments/24286016/dp_app.js""></script>",To store data in rows and columns; To execute SQL commands; To manage user access; To define data types; questions_210613020325.csv
9174725,Question 299,"<link rel=""stylesheet"" href=""https://instructure-uploads.s3.amazonaws.com/account_73010000000000001/attachments/24286017/dp_app.css"">A primary key is used to:<script src=""https://instructure-uploads.s3.amazonaws.com/account_73010000000000001/attachments/24286016/dp_app.js""></script>",Create relationships between tables; Ensure unique identification of records; Store multiple values in a column; Define data types; questions_210613020325.csv
9174726,Question 300,"<link rel=""stylesheet"" href=""https://instructure-uploads.s3.amazonaws.com/account_73010000000000001/attachments/24286017/dp_app.css"">Which SQL command is used to add new records to a table?<script src=""https://instructure-uploads.s3.amazonaws.com/account_73010000000000001/attachments/24286016/dp_app.js""></script>",SELECT; UPDATE; INSERT INTO; DELETE; questions_210613020325.csv
9174727,Question 301,"<link rel=""stylesheet"" href=""https://instructure-uploads.s3.amazonaws.com/account_73010000000000001/attachments/24286017/dp_app.css"">True or False: Foreign keys are used to ensure data integrity by referencing primary keys in other tables.<script src=""https://instructure-uploads.s3.amazonaws.com/account_73010000000000001/attachments/24286016/dp_app.js""></script>",TRUE; FALSE; questions_210613020325.csv
9174728,Question 302,"<link rel=""stylesheet"" href=""https://instructure-uploads.s3.amazonaws.com/account_73010000000000001/attachments/24286017/dp_app.css"">Which of the following is NOT a CRUD operation?<script src=""https://instructure-uploads.s3.amazonaws.com/account_73010000000000001/attachments/24286016/dp_app.js""></script>",Create; Read; Update; Join; questions_210613020325.csv
9174729,Question 303,"<link rel=""stylesheet"" href=""https://instructure-uploads.s3.amazonaws.com/account_73010000000000001/attachments/24286017/dp_app.css"">What does normalization in databases aim to achieve?<script src=""https://instructure-uploads.s3.amazonaws.com/account_73010000000000001/attachments/24286016/dp_app.js""></script>",Increase redundancy; Reduce data integrity; Organize data efficiently; Simplify SQL commands; questions_210613020325.csv
9174730,Question 304,"<link rel=""stylesheet"" href=""https://instructure-uploads.s3.amazonaws.com/account_73010000000000001/attachments/24286017/dp_app.css"">Which SQL clause is used to specify the columns to be returned in a query result?<script src=""https://instructure-uploads.s3.amazonaws.com/account_73010000000000001/attachments/24286016/dp_app.js""></script>",FROM; WHERE; SELECT; JOIN; questions_210613020325.csv
9174731,Question 305,"<link rel=""stylesheet"" href=""https://instructure-uploads.s3.amazonaws.com/account_73010000000000001/attachments/24286017/dp_app.css"">True or False: A Database Management System (DBMS) is responsible for managing collections of data accessed by multiple users.<script src=""https://instructure-uploads.s3.amazonaws.com/account_73010000000000001/attachments/24286016/dp_app.js""></script>",TRUE; FALSE; questions_210613020325.csv
9174732,Question 306,"<link rel=""stylesheet"" href=""https://instructure-uploads.s3.amazonaws.com/account_73010000000000001/attachments/24286017/dp_app.css"">Which of the following defines the kind of data that can be stored in each column?<script src=""https://instructure-uploads.s3.amazonaws.com/account_73010000000000001/attachments/24286016/dp_app.js""></script>",Data relationships; Data types; Normalization; CRUD operations; questions_210613020325.csv
9174733,Question 307,"<link rel=""stylesheet"" href=""https://instructure-uploads.s3.amazonaws.com/account_73010000000000001/attachments/24286017/dp_app.css"">Which SQL command is used to modify existing records in a table?<script src=""https://instructure-uploads.s3.amazonaws.com/account_73010000000000001/attachments/24286016/dp_app.js""></script>",INSERT INTO; UPDATE; DELETE; SELECT; questions_210613020325.csv
9174734,Question 308,"<link rel=""stylesheet"" href=""https://instructure-uploads.s3.amazonaws.com/account_73010000000000001/attachments/24286017/dp_app.css"">Which of the following operations is part of the CRUD framework?<script src=""https://instructure-uploads.s3.amazonaws.com/account_73010000000000001/attachments/24286016/dp_app.js""></script>",Create; Read; Update; All of the above; questions_210613020325.csv
9174735,Question 309,"<link rel=""stylesheet"" href=""https://instructure-uploads.s3.amazonaws.com/account_73010000000000001/attachments/24286017/dp_app.css"">True or False: Data relationships are not important for accurate processing and reporting.<script src=""https://instructure-uploads.s3.amazonaws.com/account_73010000000000001/attachments/24286016/dp_app.js""></script>",TRUE; FALSE; questions_210613020325.csv
9174736,Question 310,"<link rel=""stylesheet"" href=""https://instructure-uploads.s3.amazonaws.com/account_73010000000000001/attachments/24286017/dp_app.css"">What is the role of JOIN operations in SQL?<script src=""https://instructure-uploads.s3.amazonaws.com/account_73010000000000001/attachments/24286016/dp_app.js""></script>",To delete records; To combine data from multiple tables; To create new tables; To define data types; questions_210613020325.csv
9174737,Question 311,"<link rel=""stylesheet"" href=""https://instructure-uploads.s3.amazonaws.com/account_73010000000000001/attachments/24286017/dp_app.css"">Which of the following is a benefit of normalization?<script src=""https://instructure-uploads.s3.amazonaws.com/account_73010000000000001/attachments/24286016/dp_app.js""></script>",Increased redundancy; Improved data integrity; Simplified data types; Faster SQL execution; questions_210613020325.csv
9174738,Question 312,"<link rel=""stylesheet"" href=""https://instructure-uploads.s3.amazonaws.com/account_73010000000000001/attachments/24286017/dp_app.css"">Which SQL command is used to remove records from a table?<script src=""https://instructure-uploads.s3.amazonaws.com/account_73010000000000001/attachments/24286016/dp_app.js""></script>",INSERT INTO; UPDATE; DELETE; SELECT; questions_210613020325.csv
9174739,Question 313,"<link rel=""stylesheet"" href=""https://instructure-uploads.s3.amazonaws.com/account_73010000000000001/attachments/24286017/dp_app.css"">Which of the following best describes a primary key?<script src=""https://instructure-uploads.s3.amazonaws.com/account_73010000000000001/attachments/24286016/dp_app.js""></script>",A key that allows multiple entries; A unique identifier for each record; A key that links tables; A type of data; questions_210613020325.csv
9174740,Question 314,"<link rel=""stylesheet"" href=""https://instructure-uploads.s3.amazonaws.com/account_73010000000000001/attachments/24286017/dp_app.css"">True or False: SQL is not necessary for managing relational databases.<script src=""https://instructure-uploads.s3.amazonaws.com/account_73010000000000001/attachments/24286016/dp_app.js""></script>",TRUE; FALSE; questions_210613020325.csv
9174741,Question 315,"<link rel=""stylesheet"" href=""https://instructure-uploads.s3.amazonaws.com/account_73010000000000001/attachments/24286017/dp_app.css"">Which of the following is a characteristic of a foreign key?<script src=""https://instructure-uploads.s3.amazonaws.com/account_73010000000000001/attachments/24286016/dp_app.js""></script>",It must be unique; It can reference multiple tables; It creates relationships between tables; It is always a primary key; questions_210613020325.csv
9174742,Question 316,"<link rel=""stylesheet"" href=""https://instructure-uploads.s3.amazonaws.com/account_73010000000000001/attachments/24286017/dp_app.css"">Which of the following actions does the 'Read' operation in CRUD refer to?<script src=""https://instructure-uploads.s3.amazonaws.com/account_73010000000000001/attachments/24286016/dp_app.js""></script>",Adding new data; Retrieving existing data; Updating data; Deleting data; questions_210613020325.csv
9174743,Question 317,"<link rel=""stylesheet"" href=""https://instructure-uploads.s3.amazonaws.com/account_73010000000000001/attachments/24286017/dp_app.css"">Which of the following is NOT a key component of SQL?<script src=""https://instructure-uploads.s3.amazonaws.com/account_73010000000000001/attachments/24286016/dp_app.js""></script>",SELECT; INSERT INTO; JOIN; Normalize; questions_210613020325.csv
9174744,Question 318,"<link rel=""stylesheet"" href=""https://instructure-uploads.s3.amazonaws.com/account_73010000000000001/attachments/24286017/dp_app.css"">True or False: Data types help in optimizing performance by enforcing specific formats.<script src=""https://instructure-uploads.s3.amazonaws.com/account_73010000000000001/attachments/24286016/dp_app.js""></script>",TRUE; FALSE; questions_210613020325.csv
9174745,Question 319,"<link rel=""stylesheet"" href=""https://instructure-uploads.s3.amazonaws.com/account_73010000000000001/attachments/24286017/dp_app.css"">Which of the following best describes a Database Management System (DBMS)?<script src=""https://instructure-uploads.s3.amazonaws.com/account_73010000000000001/attachments/24286016/dp_app.js""></script>",A programming language; A tool for data analysis; A system for managing data collections; A type of database; questions_210613020325.csv
9174746,Question 320,"<link rel=""stylesheet"" href=""https://instructure-uploads.s3.amazonaws.com/account_73010000000000001/attachments/24286017/dp_app.css"">Which of the following operations is essential for maintaining data integrity?<script src=""https://instructure-uploads.s3.amazonaws.com/account_73010000000000001/attachments/24286016/dp_app.js""></script>",Normalization; CRUD; Data types; All of the above; questions_210613020325.csv
9174747,Question 321,"<link rel=""stylesheet"" href=""https://instructure-uploads.s3.amazonaws.com/account_73010000000000001/attachments/24286017/dp_app.css"">What is the purpose of the SELECT clause in SQL?<script src=""https://instructure-uploads.s3.amazonaws.com/account_73010000000000001/attachments/24286016/dp_app.js""></script>",To specify the table; To define the conditions; To choose columns to return; To delete records; questions_210613020325.csv
9174748,Question 322,"<link rel=""stylesheet"" href=""https://instructure-uploads.s3.amazonaws.com/account_73010000000000001/attachments/24286017/dp_app.css"">True or False: Normalization increases redundancy in a database.<script src=""https://instructure-uploads.s3.amazonaws.com/account_73010000000000001/attachments/24286016/dp_app.js""></script>",TRUE; FALSE; questions_210613020325.csv
9174749,Question 323,"<link rel=""stylesheet"" href=""https://instructure-uploads.s3.amazonaws.com/account_73010000000000001/attachments/24286017/dp_app.css"">Which of the following is a key benefit of using a DBMS?<script src=""https://instructure-uploads.s3.amazonaws.com/account_73010000000000001/attachments/24286016/dp_app.js""></script>",Increased data redundancy; Improved data management; Limited user access; Reduced data integrity; questions_210613020325.csv
9174750,Question 324,"<link rel=""stylesheet"" href=""https://instructure-uploads.s3.amazonaws.com/account_73010000000000001/attachments/24286017/dp_app.css"">Which SQL command would you use to change the value of an existing record?<script src=""https://instructure-uploads.s3.amazonaws.com/account_73010000000000001/attachments/24286016/dp_app.js""></script>",INSERT INTO; UPDATE; DELETE; SELECT; questions_210613020325.csv
9174751,Question 325,"<link rel=""stylesheet"" href=""https://instructure-uploads.s3.amazonaws.com/account_73010000000000001/attachments/24286017/dp_app.css"">Which of the following describes the relationship between tables in a relational database?<script src=""https://instructure-uploads.s3.amazonaws.com/account_73010000000000001/attachments/24286016/dp_app.js""></script>",They are independent; They can be linked through foreign keys; They must have the same number of columns; They cannot share data; questions_210613020325.csv
9174752,Question 326,"<link rel=""stylesheet"" href=""https://instructure-uploads.s3.amazonaws.com/account_73010000000000001/attachments/24286017/dp_app.css"">True or False: CRUD operations are not necessary for effective database management.<script src=""https://instructure-uploads.s3.amazonaws.com/account_73010000000000001/attachments/24286016/dp_app.js""></script>",TRUE; FALSE; questions_210613020325.csv
9174753,Question 327,"<link rel=""stylesheet"" href=""https://instructure-uploads.s3.amazonaws.com/account_73010000000000001/attachments/24286017/dp_app.css"">Which of the following is a characteristic of a primary key?<script src=""https://instructure-uploads.s3.amazonaws.com/account_73010000000000001/attachments/24286016/dp_app.js""></script>",It can be duplicated; It must be unique; It can be null; It is optional; questions_210613020325.csv
9174754,Question 328,"<link rel=""stylesheet"" href=""https://instructure-uploads.s3.amazonaws.com/account_73010000000000001/attachments/24286017/dp_app.css"">Which of the following is a key aspect of data types in databases?<script src=""https://instructure-uploads.s3.amazonaws.com/account_73010000000000001/attachments/24286016/dp_app.js""></script>",They define the structure of tables; They ensure data integrity; They are not important; They are only used in SQL; questions_210613020325.csv
9174755,Question 329,"<link rel=""stylesheet"" href=""https://instructure-uploads.s3.amazonaws.com/account_73010000000000001/attachments/24286017/dp_app.css"">Which SQL command is used to retrieve data from a database?<script src=""https://instructure-uploads.s3.amazonaws.com/account_73010000000000001/attachments/24286016/dp_app.js""></script>",INSERT INTO; UPDATE; SELECT; DELETE; questions_210613020325.csv
9174756,Question 330,"<link rel=""stylesheet"" href=""https://instructure-uploads.s3.amazonaws.com/account_73010000000000001/attachments/24286017/dp_app.css"">True or False: Foreign keys can reference primary keys in the same table.<script src=""https://instructure-uploads.s3.amazonaws.com/account_73010000000000001/attachments/24286016/dp_app.js""></script>",TRUE; FALSE; questions_210613020325.csv
9174757,Question 331,"<link rel=""stylesheet"" href=""https://instructure-uploads.s3.amazonaws.com/account_73010000000000001/attachments/24286017/dp_app.css"">Which of the following is a benefit of normalization?<script src=""https://instructure-uploads.s3.amazonaws.com/account_73010000000000001/attachments/24286016/dp_app.js""></script>",Increased redundancy; Reduced data integrity; Improved performance; More complex queries; questions_210613020325.csv
9174758,Question 332,"<link rel=""stylesheet"" href=""https://instructure-uploads.s3.amazonaws.com/account_73010000000000001/attachments/24286017/dp_app.css"">Which of the following operations is part of the CRUD framework?<script src=""https://instructure-uploads.s3.amazonaws.com/account_73010000000000001/attachments/24286016/dp_app.js""></script>",Create; Read; Update; All of the above; questions_210613020325.csv
9174759,Question 333,"<link rel=""stylesheet"" href=""https://instructure-uploads.s3.amazonaws.com/account_73010000000000001/attachments/24286017/dp_app.css"">True or False: Data relationships are essential for accurate processing and reporting.<script src=""https://instructure-uploads.s3.amazonaws.com/account_73010000000000001/attachments/24286016/dp_app.js""></script>",TRUE; FALSE; questions_210613020325.csv
9174760,Question 334,"<link rel=""stylesheet"" href=""https://instructure-uploads.s3.amazonaws.com/account_73010000000000001/attachments/24286017/dp_app.css"">Which SQL command is used to remove records from a table?<script src=""https://instructure-uploads.s3.amazonaws.com/account_73010000000000001/attachments/24286016/dp_app.js""></script>",INSERT INTO; UPDATE; DELETE; SELECT; questions_210613020325.csv
9174761,Question 335,"<link rel=""stylesheet"" href=""https://instructure-uploads.s3.amazonaws.com/account_73010000000000001/attachments/24286017/dp_app.css"">Which of the following best describes a foreign key?<script src=""https://instructure-uploads.s3.amazonaws.com/account_73010000000000001/attachments/24286016/dp_app.js""></script>",A unique identifier for a record; A key that links tables; A type of data; A command in SQL; questions_210613020325.csv
9174762,Question 336,"<link rel=""stylesheet"" href=""https://instructure-uploads.s3.amazonaws.com/account_73010000000000001/attachments/24286017/dp_app.css"">Which of the following is NOT a characteristic of a primary key?<script src=""https://instructure-uploads.s3.amazonaws.com/account_73010000000000001/attachments/24286016/dp_app.js""></script>",It must be unique; It can be null; It identifies a record; It is a column in a table; questions_210613020325.csv
